question,text1,text2,text3,text4,label
Which experimental alteration would most likely increase the peak calcium concentration within dendritic spine heads during synaptic input?,Stabilizing the membrane potential at the dendrite base to create a uniform excitatory input across spines.,"Enhancing the chemical isolation of the spine by increasing spine neck resistance, reducing diffusion to the dendrite.",Decreasing the density of calcium pumps in the spine neck to allow less calcium extrusion.,Increasing the electrical coupling between the spine head and parent dendrite to improve action potential propagation.,text2
Which aspect of synaptic plasticity is most critical for the induction of long-term enhancements in synaptic transmission?,The adjustment of synaptic background activity leading to tonic inhibition.,The manipulation of dendritic spine tortuosity to influence signal attenuation.,The regulation of synaptic vesicle release and quanta availability.,The presence of paired-pulse facilitation and its frequency-dependent modulation.,text3
"Considering the synaptic microcircuit's role within neural networks, which hypothesis could best explain the impact of dendritic spine morphology on synaptic strength and plasticity?",The length of dendritic spines solely determines the speed of action potential propagation along the dendrites.,Dendritic spine numbers influence postsynaptic cell fate by altering gene expression in the nucleus.,The angular distribution of dendritic spines directly controls neurotransmitter release probability in presynaptic neurons.,Dendritic spine shape influences synaptic strength by regulating voltage attenuation and calcium signaling pathways.,text4
Which mechanism is most likely responsible for the augmentation of synaptic transmission following repeated synaptic stimulation?,Reduction in paired-pulse facilitation due to depletion of readily releasable vesicle pool.,Increased synaptic vesicle release probability due to residual calcium accumulation.,Desensitization of postsynaptic receptors to neurotransmitter release.,Decrease in synaptic vesicle docking at presynaptic terminals.,text2
"Which process most likely accounts for the maintenance of synaptic strength following short-term potentiation, according to the indexed subjects?",Dendritic spine retraction to minimize synaptic contact.,Instantaneous ionic conductance changes resulting from transient calcium influx.,Synaptic plasticity involving synaptic weight adjustments.,Shunting inhibition through the adjustment of synaptic reversal potential.,text3
Which experimental approach is most suitable for investigating the impact of voltage-dependent channels on dendritic voltage attenuation in quasi-active membranes?,Utilizing the voltage-clamp technique to isolate voltage-dependent currents in dendritic regions.,Employing electron microscopy to assess structural changes in dendritic spine morphology.,Applying a calcium imaging technique to measure dendritic spine activity in response to synaptic inputs.,Using functional MRI to observe network-level changes in brain activity related to dendritic processing.,text1
Which aspect of neuronal cable theory best explains the decreased attenuation of voltage in a dendrite with a sealed-end boundary compared to one with a killed-end boundary?,"Voltage gradients are absent in a sealed-end cable, leading to constant voltage propagation.","The sealed-end boundary increases extracellular resistance, enhancing voltage retention.","The sealed-end boundary reflects the axial current back into the dendrite, reducing voltage decay.",Voltage decreases more quickly in the sealed-end dendrite due to increased membrane resistance.,text3
Which mechanism is most likely responsible for facilitating synaptic efficiency in dendritic spines as described in the given text?,The increase in synaptic weight leads directly to reduced synaptic reliability in dendritic spines.,The synfire chain model reduces synaptic adaptability through fixed synaptic pathways.,Synaptic plasticity is primarily driven by neurotransmitter depletion leading to reduced synaptic efficiency.,Voltage attenuation across electrical synapses enhances the synaptic efficiency by modulating input signals.,text4
Which type of synaptic plasticity is best suited to counteract paired-pulse depression in a high-frequency signaling context?,"Short-term depression, as it further reduces synaptic efficacy during rapid stimuli.","Long-term potentiation, as it is not affected by changes in stimulus frequency or temporal signaling dynamics.","Augmentation, as it can enhance synaptic release following initial activation, thereby mitigating the effects of paired-pulse depression.","Quantal release, as it primarily defines the fixed number of neurotransmitter packets released per synaptic event.",text3
Which mechanistic feature primarily enables the NMDA-receptor mediated pattern discrimination in pyramidal neurons?,The nonlinear cooperative interaction of clustered NMDA synapses enhances postsynaptic response to specific inputs.,The broad distribution of NMDA synapses across the dendritic tree uniformly boosts synaptic input.,NMDA receptors alter neuronal firing patterns by modulating voltage-independent channels.,"NMDA receptors selectively block inhibitory inputs, allowing only excitatory signals to pass.",text1
Which experimental approach would best quantify the impact of dendritic spine morphology on synaptic efficiency?,Using voltage-clamp techniques to measure synaptic currents while altering spine geometry with optogenetic tools.,Using genetic knockouts to remove specific ion channels from dendritic spines and measuring the behavioral outcomes.,Implementing whole-brain imaging to correlate spine density with long-term potentiation across different brain regions.,Applying extracellular field recordings to assess changes in local field potential amplitudes with varying spine shapes.,text1
Which aspect of synaptic plasticity is most likely influenced by the dynamics of synaptic vesicle release?,"Synaptic reliability is exclusively determined by the synaptic cleft composition, independent of synaptic vesicle release dynamics.",Paired-pulse facilitation and depression primarily depend on dendritic spine morphology rather than synaptic vesicle release dynamics.,Long-term enhancements are solely dependent on changes in receptor density and are unaffected by synaptic vesicle release dynamics.,"Short-term enhancements, such as posttetanic potentiation, can be influenced by synaptic vesicle release dynamics.",text4
Which mechanism most effectively explains the effect of synaptic microcircuits on synaptic plasticity?,Synaptic microcircuits enhance synaptic plasticity solely by increasing neurotransmitter release.,Synaptic microcircuits modulate synaptic plasticity through precise temporal and spatial coordination of synaptic inputs.,"Synaptic microcircuits have no significant impact on synaptic plasticity, acting instead as passive conduits.",Synaptic microcircuits decrease synaptic plasticity by inhibiting ion channel expression.,text2
What mechanism best explains the initiation of synaptic plasticity as mentioned in the paragraph?,Quantal release contributes to the induction of synaptic plasticity by affecting postsynaptic responses.,Synaptic plasticity is primarily driven by reduction in synaptic cleft width which facilitates neurotransmitter diffusion.,Increased density of dendritic spines directly generates synaptic plasticity without changes in neurotransmitter dynamics.,Voltage-clamp technique directly induces synaptic plasticity by stabilizing synaptic reversal potentials.,text1
"Which factor is most likely to critically influence synaptic efficacy in neural circuits, as suggested by theories of synaptic plasticity and the properties of synaptic weight?",The uniform distribution of synaptic vesicles throughout the axon terminal.,The presence of consistent post-synaptic ion transporter activity across individual neurons.,The exact frequency of paired-pulse stimulation paradigms applied to neural networks.,The intricate balance between synaptic plasticity mechanisms and dendritic spine geometry.,text4
What mechanistic factor most likely contributes to the stochastic nature of synaptic transmission in central synapses?,Variability in the voltage of action potentials arriving at presynaptic terminals leads to inconsistent vesicle release.,Inhibitory feedback mechanisms from the postsynaptic neuron result in unpredictable synaptic transmission.,The spatial relationship between calcium channels in the presynaptic membrane and the vesicle location affects local calcium concentrations necessary for exocytosis.,Random fluctuations in temperature within the synaptic cleft impact neurotransmitter diffusion rates.,text3
"Based on the principles discussed in the text, what is the primary factor enabling quasi-active membranes to exhibit inductance-like behavior?",The linear relationship between current and membrane potential.,The presence of actual inductance elements within the membrane circuit.,The time- and voltage-dependent nature of the membrane conductance.,The intrinsic capacitive properties of the neuronal membrane.,text3
Which factor is most likely to influence the attenuation of voltage in dendritic spines according to neural circuit dynamics?,Voltage attenuation is mostly affected by the action potentials generated in the axon hillock.,Voltage attenuation in dendritic spines is primarily controlled by neurotransmitter release probability.,Voltage attenuation across electrical synapses modifies synaptic efficiency and impacts dendritic voltage processing.,The presence of ion transporters primarily determines the voltage attenuation in dendritic spines.,text3
Which mechanism is most likely to explain the role of dendritic spines in synaptic strength modulation according to recent research?,Dendritic spines influence synaptic strength by facilitating localized biochemical signaling and compartmentalization.,Dendritic spines decrease synaptic strength by promoting electrical coupling between neurons.,Dendritic spines affect synaptic strength through the uniform distribution of ion channels along the dendrite.,Dendritic spines primarily enhance synaptic strength by increasing neurotransmitter release from presynaptic neurons.,text1
Which experimental condition best illustrates a reduction in spike train variability in an integrate-and-fire neuron model?,Simulating a neuron with membrane leak and spontaneous synaptic activity.,Reducing the number of synaptic inputs required to reach threshold.,Introducing synaptic connections with diverse conductance values.,Introducing a refractory period alongside increased synaptic input rate.,text4
Which experimental approach best allows for the assessment of voltage-dependent channel function in neurons?,Measurement of synaptic background activity directly reveals voltage-dependent channel function through ambient environmental conditions.,The giga-seal recording technique is suited for assessing voltage-dependent channel function through tight membrane seals.,Transfer impedance analysis is optimal for evaluating voltage-dependent channel dynamics due to its focus on dendritic electrical properties.,The voltage-clamp technique allows for precise control of membrane potential to study the function of voltage-dependent channels.,text4
Which mechanism is most likely responsible for the firing pattern observed in intrinsically bursting neurons?,The intrinsic bursting pattern is caused by neurotransmitter availability affecting synaptic release timing.,Intrinsically bursting neurons exhibit their characteristic firing due to specific ion channel dynamics that promote a sustained depolarization and repetitive bursting.,The firing pattern in intrinsically bursting neurons is primarily driven by external synaptic input variability.,Intrinsically bursting neurons fire in this manner due to morphological features such as compact dendritic arborization.,text2
Which conclusion is best supported by the concept of synaptic efficiency as influenced by voltage attenuation in dendritic spines?,Voltage attenuation in dendritic spines increases synaptic efficiency by enhancing local processing capabilities.,"Dendritic spines primarily prevent voltage attenuation, leading to enhanced synaptic efficiency and increased signal fidelity.",Synaptic efficiency remains unchanged regardless of voltage attenuation in dendritic spines due to compensatory mechanisms.,"Synaptic efficiency is reduced due to significant voltage attenuation across dendritic spines, possibly affecting signal propagation.",text4
Which neurotransmitter is primarily responsible for modulating synaptic transmission in the mammalian cerebellar Purkinje cells?,GABA acts as the primary inhibitory neurotransmitter in cerebellar Purkinje cells.,Serotonin is the dominant neurotransmitter influencing synaptic transmission in Purkinje cells.,Dopamine primarily modulates synaptic transmission in cerebellar Purkinje cells.,Glutamate is the primary excitatory neurotransmitter affecting Purkinje cells.,text1
"Considering the discussed models of dendritic branching and its implications for voltage dynamics, which statement accurately reflects the effects of daughter branch properties on current flow in a passive dendritic tree model?","The current divides among the daughter branches based on their input conductances, which are determined by the membrane and cable properties.","The distribution of current is solely determined by the length of the daughter branches, ignoring the membrane properties.","The current flow into each daughter branch depends primarily on the voltage difference across the branch points, irrespective of the conductance values.","The current distribution is uniform across all branches regardless of their conductance or diameter, as the tree behaves as an isopotential compartment.",text1
What molecular mechanism enables CaM Kinase II to maintain activity independent of calcium stimulus during synaptic plasticity?,A secondary messenger system continuously supplies calcium to sustain the activity of CaM Kinase II.,"CaM Kinase II binds to the postsynaptic density with high affinity, trapping residual calcium to maintain its activity.","CaM Kinase II undergoes intramolecular autophosphorylation, allowing it to remain active in the absence of calcium.","Phosphatase inhibition prevents dephosphorylation, thereby allowing CaM Kinase II to remain active without calcium.",text3
Which computational advantage is conferred by the use of multiple biophysical mechanisms operating in tandem within the nervous system?,"Having multiple mechanisms provides redundancy, allowing neurons to neglect certain inputs altogether.",Multiple mechanisms allow for robustness in computation because failure of any single mechanism does not compromise the entire process.,The use of multiple mechanisms ensures faster computational speeds by reducing processing complexity.,"Multiple mechanisms serve to increase the metabolic activity of the nervous system, enhancing computational outcomes.",text2
What does the morphoelectrotonic transform (MET) reveal about the propagation delay in dendritic trees?,MET applies only to the estimation of synaptic charge attenuation and cannot be used to infer changes in propagation delay.,MET indicates that the propagation delay is invariant to changes in synaptic input or neuromodulatory states.,"MET solely measures the spatial distribution of synaptic inputs along the dendritic tree, without considering temporal aspects such as delay.",MET illustrates how a change in the synaptic background or neuromodulatory input can modulate the propagation delay by affecting the electrotonic geometry.,text4
Which mechanism is most responsible for voltage attenuation in dendritic spines as discussed in current neuroscience research?,Voltage attenuation is primarily caused by the high density of ion transporters in dendritic spines.,Voltage attenuation occurs due to quasi-active membrane properties and the synaptic efficiency across electrical synapses.,Voltage attenuation results predominantly from myelination patterns in dendritic branches.,The dominant mechanism for voltage attenuation is the intrinsic high frequency of firing in cortical neurons.,text2
Which experimental design approach would most effectively isolate the effects of synaptic vesicle release on synaptic plasticity?,Utilizing voltage-clamp techniques to control postsynaptic membrane potential while measuring changes in synaptic current.,Using paired-pulse stimulation to evaluate short-term synaptic enhancements.,Applying frequency-dependent space constant analysis to understand genetic contributions to plasticity.,Employing dendritic spine imaging to observe structural changes over time.,text1
What factor is most critical for ensuring successful propagation of action potentials past a bifurcation point in an unmyelinated axon?,The frequency of action potential firing from the soma.,The presence of synaptic inputs directly at the bifurcation point.,The absolute diameter of the parent axon before bifurcation.,The geometric ratio (GR) of the axon branches at the bifurcation point.,text4
"Considering the role of synaptic vesicles in neurotransmitter release at chemical synapses, what is the most plausible effect of impairing synaptic vesicle recycling?",Enhanced long-term potentiation owing to accumulation of neurotransmitter precursors.,Stabilization of synaptic weights due to less neurotransmitter release variability.,Increased synaptic plasticity as more neurotransmitters are release-resistant.,Reduced synaptic transmission efficiency due to depletion of vesicles available for release.,text4
Which implication about the relationship between input jitter and output jitter in neural integration is best supported by the discussed model?,"Output jitter is directly proportional to input jitter, increasing linearly with it.",Output jitter remains constant regardless of the variability in temporal input distribution.,Output jitter is always greater than input jitter regardless of synaptic input conditions.,Output jitter can be reduced relative to input jitter when synaptic integration involves multiple simultaneous inputs surpassing the threshold.,text4
What is the most likely reason for synaptic vesicle release to be tightly regulated during neurotransmission?,To ensure adequate neurotransmitter release and synaptic efficacy while preventing excessive depletion of vesicles.,To decrease the reliability of synaptic transmission and prevent habituation.,To enhance neurotransmitter release consistently at all synapses regardless of activity levels.,To trigger spontaneous action potentials in postsynaptic neurons without presynaptic input.,text1
"According to the text, what is the primary role of calcium in synaptic release at presynaptic terminals?",Calcium influx rapidly increases the probability of synaptic vesicle fusion and neurotransmitter release.,Calcium solely mediates long-term synaptic enhancement by increasing receptor density on the postsynaptic membrane.,Calcium stabilizes the postsynaptic membrane potential after neurotransmitter binding.,Calcium influx prevents synaptic vesicle fusion by maintaining magnesium block in NMDA receptors.,text1
Which of the following mechanisms is most crucial for the role of calcium ions in synaptic plasticity as discussed in the text?,Calcium ions directly increase the expression of synaptic proteins by acting as a second messenger without intermediary proteins.,"Calcium ions bind to proteins like calmodulin, which then modulate enzymes and channels essential for inducing synaptic changes.","Calcium ions stabilize the neuronal membrane potential, thereby maintaining synaptic plasticity over time.","Calcium ions diffuse rapidly and freely throughout the neuron, enabling instantaneous signaling for synaptic changes.",text2
Which synaptic modification process is most directly affected by changes in synaptic vesicle release probability?,Posttetanic potentiation (PTP) is minimally affected by changes in synaptic vesicle release probability.,Paired-pulse facilitation (PPF) is most directly affected as it depends on residual calcium influencing vesicle release probability.,Long-term potentiation (LTP) is most directly affected by alterations in vesicle release probability.,Quantal release variability has no effect on any short-term synaptic enhancement processes.,text2
"Considering the synaptic mechanisms described, which factor is most likely to influence the stabilization of synaptic plasticity?",The frequency of synaptic vesicle release.,The balance between synaptic excitation and inhibition.,The presence of dendritic spines only.,The overall size of the synaptic cleft.,text2
What is the primary mechanism underlying adaptation in spike frequency in the integrate-and-fire model as described in the text?,"An increase in the sodium current amplitude with each successive spike, causing greater depolarization.","The progressive inactivation of voltage-gated calcium channels, reducing their influence on membrane potential.","A time-dependent shunting conductance, simulating a calcium-dependent potassium current, that increases with each spike and decays between spikes.","A decrease in the leak conductance, allowing more accumulation of membrane potential.",text3
What mechanistic feature of calmodulin specifically allows it to act as an efficient calcium buffer in neurons?,The protein's ability to bind calcium ions non-cooperatively ensures uniform calcium distribution.,The uniform dissociation constants across all binding sites optimize calcium release during neural signaling.,Its dumbbell-shaped structure facilitates rapid diffusion across neuronal membranes.,Positive cooperativity in calcium binding increases the affinity of subsequent binding sites upon initial calcium binding.,text4
Which parameter would be most effective in modulating synaptic efficacy through dendritic spine interactions?,Transfer impedance within cortical neurons.,Time constant of voltage-dependent channel currents.,Voltage attenuation across dendritic spines.,Transient space constant influencing dendritic tree topology.,text3
Which experimental condition would most effectively test the role of dendritic spines in synaptic weight modulation?,Manipulating the morphology of dendritic spines and measuring changes in synaptic strength.,Applying general synaptic inhibition and monitoring network oscillations.,Recording from dendritic shafts while inhibiting axonal action potentials.,Blocking all voltage-dependent channels in the neuron and observing synaptic transmission.,text1
Which mechanism is most likely responsible for modifying synaptic weight during synaptic plasticity?,Synaptic vesicles directly change synaptic weight by altering their shape.,"Dendritic spines adapt their structure in response to calcium triggers, affecting synaptic weight.",Synaptic weight is solely determined by the amount of neurotransmitter released.,Ion transporters solely increase synaptic weight by moving ions across the membrane.,text2
What experimental approach would most effectively measure the reliability of synaptic transmission under varying neurotransmitter concentration?,Applying confocal microscopy to visualize neurotransmitter diffusion and assess reliability based on diffusion patterns.,Using paired-pulse facilitation to assess changes in synaptic efficacy by examining response variability across different neurotransmitter levels.,"Using patch clamp to measure individual ionic channel activity, thus inferring synaptic reliability from single ion flow recordings.",Employing voltage-clamp technique to capture synaptic currents and thus directly measure neurotransmitter release probabilities.,text2
What is the most likely impact of paired-pulse facilitation (PPF) on synaptic plasticity?,PPF induces a decrease in synaptic weight through downregulation of postsynaptic receptor sensitivity.,PPF results in a prolonged increase in synaptic strength known as long-term potentiation.,"PPF can enhance synaptic transmission by temporarily increasing neurotransmitter release probability, thus contributing to short-term synaptic plasticity.","PPF reduces synaptic transmission by decreasing neurotransmitter availability, leading to long-term synaptic depression.",text3
"In the context of synaptic interactions, what impact does paired-pulse facilitation (PPF) have on synaptic plasticity mechanisms?","PPF selectively suppresses inhibitory synaptic transmission, fostering increased excitability in neural circuits.",PPF leads to a long-term decrease in synaptic strength by promoting prolonged neurotransmitter reuptake.,PPF temporarily increases synaptic efficacy by enhancing neurotransmitter release in response to two closely spaced stimuli.,PPF results in a permanent alteration of synaptic structure by increasing the number of dendritic spines.,text3
Which aspect of synaptic plasticity is most directly influenced by the synaptic reliability mentioned in the text?,The overall number of synaptic vesicles available within the presynaptic terminal.,The rate of synaptic vesicle recycling during periods of increased neural activity.,The intrinsic firing pattern of hippocampal GABAergic interneurons.,The consistency of neurotransmitter release affecting long-term synaptic potentiation.,text4
