question,text1,text2,text3,text4,label
Which cellular mechanism is most likely responsible for the burst firing mode in thalamic relay neurons as described in the text?,Activation of N-type calcium currents during hyperpolarizing inputs causes prolonged sodium spikes resulting in burst firing.,The removal of inactivation of T-type calcium currents due to hyperpolarization facilitates burst firing by enabling low-threshold calcium spikes.,"The deactivation of potassium currents during hyperpolarization prevents regular spiking, enabling burst firing.",The activation of L-type calcium currents generates high-threshold calcium spikes that lead to burst firing.,text2
"Based on the reference to synaptic plasticity and its components, which approach best describes how increasing paired-pulse facilitation (PPF) influences synaptic efficiency in the context of learning and memory?",Increasing PPF has little to no effect on synaptic efficiency as it only modulates post-synaptic receptor sensitivity independent of neurotransmitter release.,"Increasing PPF decreases synaptic efficacy by reducing neurotransmitter release probability, thus weakening synaptic connections.","Increasing PPF enhances short-term synaptic efficacy by temporarily boosting neurotransmitter release probability, which can facilitate the induction of long-term potentiation.",Increasing PPF directly induces long-term depression by activating synaptic degradation pathways through overstimulation.,text3
Which method is most appropriate for ensuring numerical stability while solving nonlinear cable equations for neurons with complex dendritic branching?,"Using the backward Euler scheme, which evaluates spatial derivatives at the next time point, ensuring stability for all discretization steps.",Implementing a semi-implicit discretization in space rather than time to leverage the sparseness of hierarchical matrices in complex dendritic structures.,Applying a simple implicit scheme that does not consider the spatial derivatives and solely focuses on temporal discretization.,Utilizing the forward Euler method to explicitly evaluate spatial derivatives at the current time step for straightforward calculations.,text1
Which experimental technique would most effectively determine the role of dendritic spines in synaptic plasticity?,Electroencephalography (EEG) to record electrical activity patterns.,MRI to measure changes in brain volume.,Patch-clamp recordings of neuronal soma.,Two-photon laser scanning microscopy combined with calcium imaging.,text4
Which aspect of synaptic mechanisms is most influenced by paired-pulse facilitation (PPF) in neural circuits?,PPF is responsible for initiating long-term potentiation by permanently increasing synaptic strength.,PPF primarily enhances short-term synaptic plasticity by increasing synaptic strength temporarily.,PPF leads to downregulation of synaptic vesicle release as a form of synaptic depression.,"PPF functions to inhibit dendritic spine turnover, thereby stabilizing synaptic connections.",text2
Which experimental manipulation would most effectively test for the presence of paired-pulse facilitation in a synaptic microcircuit?,Applying a long-duration tetanic stimulation to induce long-term potentiation.,Blocking GABAergic inhibition to isolate excitatory synaptic responses.,Delivering two closely timed electrical pulses to the presynaptic neuron and recording postsynaptic responses to assess changes in amplitude.,Increasing the extracellular calcium concentration to enhance neurotransmitter release probability.,text3
Which experimental method would best determine the effects of voltage attenuation on synaptic efficacy across dendritic spines?,Voltage-clamp technique to measure changes in membrane potential and synaptic current flow in isolated dendritic segments.,Immunohistochemical staining to visualize protein expression changes associated with synaptic function.,Electroencephalography (EEG) to monitor overall brain wave patterns and relate them to synaptic changes.,Functional magnetic resonance imaging (fMRI) to detect neural activity level changes in the visual cortex.,text1
"Which mechanism is most likely responsible for the induction of synaptic plasticity, particularly long-term enhancements, as discussed in the text?",The increase in temporal coding precision and threshold determination.,The coordinated regulation of synaptic vesicle release and synaptic weight adjustments.,The interaction between weakly stationary processes and synfire chain models.,The reduction in voltage attenuation across electrical synapses.,text2
"In the context of synaptic plasticity, which mechanism best explains the role of gas-based computation in altering synaptic weight?",Gas-based computation modulates synaptic weight by affecting dendritic spine changes associated with synaptic plasticity.,Gas-based computation directly amplifies action potential generation to alter synaptic weight.,Gas-based computation stabilizes synaptic weight by maintaining consistent inhibitory tone across synapses.,Gas-based computation enhances synaptic weight exclusively through increased neurotransmitter release.,text1
Which process is most likely to cause a decrease in synaptic strength at a neuronal synapse over short-term stimulation?,Paired-pulse depression is the process leading to a decrease in synaptic strength during short-term stimulation.,Long-term potentiation causes a typical decrease in synaptic strength during short-term stimulation.,Paired-pulse facilitation generally results in a reduction of synaptic strength over short-term stimulation.,Posttetanic potentiation leads to a decrease in synaptic strength in the context of short-term stimulation.,text1
"What is the primary mechanistic explanation given for the subtractive effect of shunting inhibition on neuronal firing rates, as discussed in the paragraph?","The inhibitory conductance permanently alters the reversal potential, leading to a net decrease in excitation.","The effect of inhibition is always stronger at distal dendritic locations, reducing its impact on firing rates.","Inhibition acts as a multiplicative factor on the synaptic input, dynamically reducing excitability across conditions.","The somatic membrane potential does not exceed the voltage threshold, limiting the maximal inhibitory current.",text4
Which of the following describes a primary factor determining the velocity of action potential propagation in an unmyelinated axon according to the Hodgkin-Huxley model?,The propagation velocity is proportional to the square root of the axonal diameter.,The propagation speed is directly proportional to the axon's membrane capacitance.,The velocity is invariant to changes in axon diameter and solely depends on temperature.,Velocity is primarily determined by the axon's overall length rather than its diameter.,text1
"Considering the role of dendritic spines in neural signal processing, what mechanism primarily contributes to the modulation of synaptic strength?","Changes in dendritic spine morphology, affecting synaptic weight.",Variations in voltage attenuation due to dendritic spine tortuosity factor.,Adjustments in gas-based computation within the synaptic microcircuit.,"Alterations in the synaptic cleft dimensions, influencing neurotransmitter diffusion.",text1
"Based on the concept of synaptic enhancement, which experimental approach would most likely demonstrate increased synaptic strength in a hippocampal neuron network?",Applying theta-burst stimulation to induce long-term potentiation (LTP).,Administering a broad-spectrum GABA receptor antagonist to enhance overall excitation.,Using paired-pulse facilitation to elicit short-term increases in synaptic strength.,Introducing AMPA receptor blockade to prevent excessive synaptic transmission.,text1
Which feature of calcium currents is least likely to vary significantly among different types of neurons?,The sensitivity of calcium currents to membrane depolarization.,The specific inactivation kinetics of calcium currents.,The inward direction of calcium currents upon activation.,The spatial location of calcium currents within the neuron.,text3
What is the most likely effect of enhanced tonic inhibition on synaptic plasticity within neural networks?,Tonic inhibition primarily affects synaptic plasticity by directly enhancing the release of neurotransmitters from synaptic vesicles.,Enhanced tonic inhibition would lead to increased synaptic plasticity through the upregulation of dendritic spine density.,Enhanced tonic inhibition would likely suppress synaptic plasticity by maintaining membrane potentials further from the threshold required for plasticity induction.,Enhanced tonic inhibition would result in increased synaptic plasticity by promoting greater depolarization and neuronal firing.,text3
Which mechanism is most likely responsible for the induction of synaptic plasticity noted in the index?,Dendritic spine triads alone initiate the induction of synaptic plasticity by supporting neurotransmitter release.,Calcium triggers are responsible for the induction of synaptic plasticity by facilitating the activation of intracellular signaling pathways.,Voltage decay inherently drives synaptic plasticity by modulating the synaptic cleft width.,Quantal release initiates synaptic plasticity through voltage attenuation across dendritic spines.,text2
Which mechanistic concept best explains the impact of synaptic weight changes on synaptic plasticity as described in the text?,"Synaptic weight changes primarily affect axonal propagation speed, which in turn modifies synaptic plasticity.","Alterations in synaptic weight influence the efficacy of synaptic transmission, thereby modulating synaptic plasticity processes like LTP and LTD.","Synaptic weight alterations are predominantly dictated by the ionic concentration gradients across the synapse, affecting plasticity directly.",Adjustments in synaptic weight are independent and do not significantly influence synaptic plasticity mechanisms.,text2
Which mechanism is most likely responsible for synaptic strength modification involving dendritic spines as detailed in the provided index?,"Synaptic plasticity, as it relates to dendritic spine modulation, plays a crucial role in altering synaptic weight.",Gas-based computation significantly influences synaptic strength through dendritic spine involvement.,Synaptic reversal battery governs changes in synaptic weight via dendritic spine adjustments.,The synfire chain model directly modulates dendritic spine-related synaptic strength alterations.,text1
"In the context of synaptic plasticity, which synaptic mechanism is most likely critical for regulating short-term synaptic enhancements?",Posttetanic potentiation (PTP) caused primarily by global network activities.,Long-term potentiation resulting exclusively from increases in post-synaptic receptor density.,Paired-pulse depression (PPD) due to increased post-synaptic inhibitory receptor engagement.,Paired-pulse facilitation (PPF) due to residual calcium in the presynaptic terminal.,text4
"Based on the index entries related to synaptic plasticity, which experiment would most effectively isolate the mechanisms of short-term synaptic enhancement in a neuronal circuit?",Measuring synaptic vesicle release probability during long-term potentiation induction.,Investigating quanta! release at resting membrane potential without temporal manipulation.,Conducting paired-pulse facilitation experiments to observe temporal enhancement effects.,Analyzing posttetanic potentiation using constant frequency stimulation.,text3
What is the primary role of dendritic spines in synaptic plasticity as it relates to synaptic weight changes?,Dendritic spines increase synaptic plasticity by reducing neurotransmitter release probability.,Dendritic spines enhance synaptic transmission by exclusively recycling neurotransmitter vesicles.,"Dendritic spines serve as independent compartments for localized signaling, thereby playing a crucial role in activity-dependent adjustments of synaptic weight.",Dendritic spines primarily serve to increase the speed of action potential propagation along the dendrite.,text3
Which aspect of synaptic transmission would most likely be affected by alterations in synaptic vesicle dynamics?,The frequency and probability of neurotransmitter release during synaptic transmission.,The composition of ion channels on the postsynaptic membrane.,The shape and size of dendritic spines on postsynaptic neurons.,The intrinsic firing patterns of presynaptic neurons.,text1
What mechanism is most likely responsible for the phenomenon of a spine acting as a synaptic amplifier?,The elongation and increased surface area of the spine neck allow for a greater influx of synaptic current.,The high density of excitatory synapses on a spine causes a summation of inputs that results in amplified signaling.,Increased calcium concentration in the spine head directly enhances electrical conduction to the dendrite.,The presence of fast sodium and delayed-rectifier potassium conductances in the spine head can lead to all-or-nothing action potentials.,text4
Which neural computational strategy is best exemplified by the dendritic mechanism described in the text involving weakly excitable conductances for coincidence detection?,Submillisecond temporal resolution in encoding information through precise timing of synaptic inputs.,Improved signal fidelity by suppressing noise through extensive axonal branching.,Robust signal transmission by encoding information in the frequency of action potentials.,Enhancement of firing rate reliability through spatially clustered synaptic inputs.,text1
What key mechanistic difference characterizes the onset of oscillations in the Morris-Lecar model compared to the FitzHugh-Nagumo model?,The Morris-Lecar model can exhibit oscillations with arbitrarily low frequencies due to a saddle-node bifurcation.,Oscillations in the Morris-Lecar model always start with higher frequencies due to a supercritical Hopf bifurcation.,The Morris-Lecar model exhibits oscillations solely through alterations in sodium channel dynamics.,"The Morris-Lecar model uses a higher conductance for calcium channels, leading to frequency changes.",text1
Which experimental approach would best verify the hypothesis that synaptic vesicle release contributes to synaptic plasticity?,Measure the amplitude of dendritic tree responses using a transfer impedance assay.,Use a voltage-clamp technique to measure changes in postsynaptic currents following vesicle manipulation.,Apply calcium triggers to monitor thalamic cell activity changes.,Record membrane potential fluctuations using a time average membrane potential technique post-vesicle release.,text2
Which mechanism is most likely responsible for the stability of synaptic responses under varying background activity conditions?,Voltage-dependent channels directly maintain synaptic response stability regardless of background changes.,Synaptic cleft dynamics are the primary determinants of stable synaptic responses against fluctuating activity.,Dendritic spine geometry solely ensures the stability of synaptic responses in varying conditions.,Synaptic background activity can modulate time constants that adjust synaptic response stability.,text4
Which mechanism is most likely responsible for synaptic depression observed in paired-pulse protocols?,Enhanced synapse stabilization through increased tonic inhibition during the first pulse.,Altered ion transporter activity resulting in decreased excitability of postsynaptic cells.,Reduced availability of synaptic vesicles for release during the second pulse.,Increased dendritic spine motility during the second pulse leading to synaptic weakening.,text3
Which factor is most likely to directly influence synaptic efficiency across electrical synapses in dendritic trees?,Temporal differentiation at dendritic spine triads.,Gas-based computation within synaptic vesicles.,Voltage attenuation across electrical synapses.,Synaptic microcircuits interaction.,text3
Which synaptic mechanism is most likely enhanced by a reduction in paired-pulse depression (PPD)?,Increased long-term depression owing to reduced synaptic variability.,Increased synaptic facilitation leading to enhanced neurotransmitter release.,Stabilization of synaptic weights through decreased synaptic noise.,Decreased synaptic plasticity due to impaired neurotransmitter release.,text2
Which factor most significantly enhances the efficacy of shunting inhibition in vetoing excitatory postsynaptic potentials (EPSPs) within a dendritic tree?,Increasing the amplitude of the excitatory input while keeping the inhibitory input constant.,Positioning the inhibitory synapse on the direct path between the excitatory synapse and the soma.,Locating the inhibitory synapse in a distant branch from the excitatory input.,"Ensuring the inhibitory input is much greater than the excitatory input, regardless of spatial arrangement.",text2
Which mechanism is primarily involved in increasing synaptic strength in response to repetitive activity in neurons?,Dendritic spines primarily increase synaptic strength through transfer impedance modulation.,Shunting inhibition enhances synaptic strength by altering the reversal potential.,Voltage attenuation across electrical synapses boosts synaptic strength by improving synaptic efficiency.,Long-term potentiation is primarily involved in increasing synaptic strength following repetitive activity.,text4
What is the primary mechanism through which synaptic plasticity influences synaptic weight?,Synaptic plasticity alters synaptic weight by modulating dendritic spines and the efficiency of synaptic transmission.,Synaptic plasticity changes synaptic weight by directly modifying the synaptic vesicle binding kinetics.,Synaptic plasticity affects synaptic weight by selectively shifting the synaptic reversal potential.,Synaptic plasticity influences synaptic weight primarily through the induction of synaptic cleft micromechanics changes.,text1
"Considering the mechanistic details of synaptic plasticity, which molecular alteration is most likely to underlie enhanced synaptic strength in dendritic spines?",Stabilization of synaptic interactions through paired-pulse facilitation.,Increased synaptic weight due to augmented quanta release in response to repetitive stimulation.,Enhanced synaptic microcircuit integration through reduced short-term depression.,Decreased synaptic weight as a result of posttetanic potentiation.,text2
What is the primary mechanism by which paired-pulse facilitation (PPF) enhances synaptic transmission?,PPF involves increasing the absolute number of neurotransmitter vesicles available for release.,PPF acts by prolonging the opening of post-synaptic voltage-gated ion channels.,PPF enhances synaptic transmission by increasing the probability of neurotransmitter release following successive stimuli.,"PPF decreases the synaptic cleft distance, allowing for faster neurotransmitter diffusion.",text3
What is the most likely impact of shunting inhibition on the synaptic reversal potential in neurons?,"Shunting inhibition directly hyperpolarizes the membrane, lowering the reversal potential.","Shunting inhibition has no impact on the synaptic reversal potential, affecting only spike timing.",Shunting inhibition enhances synaptic strength thereby increasing the reversal potential.,Shunting inhibition stabilizes the synaptic reversal potential by reducing input impedance.,text4
What condition is essential for reducing a branching dendritic tree to a single equivalent cylinder according to the principle of impedance matching?,The diameters of the parent and daughter branches must be identical.,The equivalent cylinder must have an axon terminating at the same distance from the soma as the dendritic branches.,The infinite input resistance of the parent cable must be matched to the infinite input resistances of the two daughter branches in parallel.,Input currents must be identical at all corresponding dendritic locations to calculate an accurate equivalent cylinder.,text3
Which statement best describes the differential effect of proximal versus distal inhibition on synaptic input in a neuron?,"Proximal inhibition selectively enhances EPSP amplitude by modulating input resistance, which is different from the effect of distal inhibition.","Distal inhibition results in absolute suppression of EPSP amplitude similar to proximal inhibition, but only with stronger inhibitory inputs.","Proximal inhibition results in absolute suppression of EPSP amplitude regardless of excitation level, whereas distal inhibition can be overcome by increased excitation.",Both proximal and distal inhibition result in absolute suppression of EPSP amplitude that cannot be overcome by increased excitation.,text3
Which statement best explains the influence of massive synaptic input on the temporal output jitter of spiking neurons?,Massive synaptic input initially increases then decreases the temporal output jitter due to inhibitory feedback.,"Massive synaptic input reduces the temporal output jitter, making it smaller than the input jitter.",The temporal output jitter remains unaffected by the amount of synaptic input.,Massive synaptic input increases the temporal output jitter due to prolonged depolarization.,text2
Which mechanism best explains the role of dendritic spines in modulating synaptic strength?,Dendritic spines reduce synaptic weight by causing a decrease in the number of ion channels on the postsynaptic membrane.,Dendritic spines enhance synaptic strength by increasing the calcium buffering capacity within the synapse.,Dendritic spines influence synaptic strength by modulating voltage attenuation along the dendritic tree.,Dendritic spines primarily change synaptic strength by altering the frequency of synaptic vesicle release.,text3
"Considering the mechanisms of synaptic plasticity discussed, which experimental manipulation could most effectively demonstrate the role of paired-pulse depression (PPD) in synaptic transmission?",Blocking all ionotropic receptors to quantify the effects on neurotransmitter release during synaptic activity.,Administering rapid successive stimuli to a nerve fiber and measuring the decrement in neurotransmitter release.,Supplying a Ca2+ chelator to synaptic junctions to assess decreased neurotransmitter release.,Increasing the duration of individual synaptic stimulations and observing enhanced neurotransmitter release.,text2
"What role does dendritic morphology play in the generation of intrinsic firing patterns, such as bursting, in cortical neurons?","Dendritic morphology alters calcium channel density uniformly, resulting in non-bursting firing patterns.","Dendritic morphology, particularly the extensive dendritic arborization, prolongs backpropagating sodium spikes enabling bursting behavior.","Dendritic morphology directly determines the speed of sodium channel activation, influencing the firing rate.","Dendritic morphology impacts the integration of synaptic inputs, unrelated to intrinsic firing patterns like bursting.",text2
Which aspect of synaptic plasticity is most directly influenced by the induction mechanisms outlined in the text?,"The primary effect of the induction process is to alter dendritic spine morphology, not synaptic strength.",The induction of synaptic plasticity directly impacts both short-term and long-term enhancements.,Induction mechanisms solely affect the reliability of synaptic transmission and have no bearing on synaptic plasticity.,Induction primarily influences synaptic cleft architecture rather than plasticity processes.,text2
"In the context of synaptic plasticity, which mechanism is most directly involved in the induction of long-term potentiation (LTP)?",Downregulation of dendritic spine density to increase synaptic effectiveness.,Inhibition of GABAergic interneurons leading to increased excitability of neighboring neurons.,Enhanced activity of voltage-gated sodium channels at the presynaptic terminal.,Activation of NMDA receptors and subsequent calcium influx into the postsynaptic neuron.,text4
"In the context of synaptic interactions, what role do dendritic spines most likely play with regard to synaptic plasticity?",Dendritic spines are irrelevant to synaptic plasticity and only maintain structural stability.,Dendritic spines inhibit synaptic plasticity by reducing synaptic strength.,Dendritic spines primarily function to facilitate gaseous communication within synapses.,Dendritic spines contribute to synaptic weight changes and are integral to the expression of synaptic plasticity.,text4
What experimental intervention would most effectively reveal the role of voltage-gated calcium channels in dendritic spines of hippocampal neurons?,Application of broad-spectrum sodium channel blockers to visualize synaptic activity.,Use of calcium imaging coupled with a specific blocker of voltage-gated calcium channels like -conotoxin-GVIA.,Inhibition of glutamate receptors to observe changes in excitatory postsynaptic potentials.,Blocking ATP-dependent transporters to study ion flux in the spines.,text2
What mechanism most likely explains the role of dendritic spines in modulating synaptic strength?,Dendritic spines modulate synaptic strength by directly altering the membrane potential of postsynaptic neurons.,Dendritic spines decrease synaptic strength by sequestering neurotransmitters away from the synaptic cleft.,"Dendritic spines alter synaptic strength by increasing neuronal input resistance, thereby reducing overall synaptic input.",Dendritic spines enhance synaptic strength through compartmentalization of signaling molecules and increasing the probability of synaptic transmission.,text4
