question,text1,text2,text3,text4,label
Which cellular mechanism is primarily responsible for the maintenance of synaptic vesicle recycling at nerve terminals?,Specialized transporters called vesicular transporters refilling the synaptic vesicles.,Direct fusion of the Golgi-derived vesicles with the presynaptic membrane during neurotransmission.,Continuous translation of neurotransmitter-related mRNAs at the synapse.,Spontaneous generation of synaptic vesicles from fragments of the plasma membrane.,text1
What is a primary mechanism through which modern neuroscience enhances our understanding of perception?,Modern neuroscience offers insights into the construction of perceptual experiences from sensory inputs.,Modern neuroscience suggests perception is solely a result of genetic programming.,Modern neuroscience primarily focuses on altering sensory organs to modify perception.,Modern neuroscience disproves the existence of perceptual experiences in the absence of direct stimuli.,text1
Which process in the olfactory system most likely explains the rapid adaptation and quick recovery of sensitivity to persistent odors?,Increased lateral inhibition among glomeruli in the olfactory bulb leads to rapid odor adaptation and recovery.,Prolonged activation of olfactory bulb mitral cells causes adaptation and quick recovery in sensitivity.,Enhanced GABAergic activity in the olfactory cortex mediates adaptation and restores sensitivity to persistent odors.,Modulation of a cyclic nucleotide-gated ion channel in olfactory cilia is responsible for the adaptation to persistent odors.,text4
Which molecular mechanism is primarily responsible for the induction of late-phase long-term potentiation (LTP) at Schaffer collateral synapses in the hippocampus?,Late-phase LTP induction is solely dependent on the insertion of AMPA receptors into the postsynaptic membrane without protein synthesis.,Late-phase LTP induction requires the synthesis of new proteins and involves the activation of transcription factors like CREB.,Late-phase LTP is induced by the removal of inhibitory neurotransmitters from the synaptic cleft.,Late-phase LTP induction occurs exclusively due to increased presynaptic neurotransmitter release.,text2
What is the most plausible mechanism underlying increased schizophrenia risk associated with elevated expression of complement factor C4A in the brain?,Enhanced cortical excitability caused by excessive complement activation in astrocytes.,Aberrant neurotransmitter release triggered by complement-driven vesicular dysfunction.,Excessive synaptic pruning mediated by complement-tagged synapses and microglial phagocytosis.,Impaired synapse formation due to complement-mediated inhibition of neurite outgrowth.,text3
Which mechanism best explains the role of IP3 in signal transduction pathways triggered by G protein-coupled receptors?,IP3 binds to membrane phospholipids to trigger the formation of DAG.,IP3 releases Ca2+ from intracellular stores by binding to IP3 receptors on the smooth endoplasmic reticulum.,IP3 directly phosphorylates proteins to change their function.,"IP3 inhibits phospholipase C activity, preventing further signaling cascade activation.",text2
Which molecular defect is most likely responsible for the demyelination observed in Charcot-Marie-Tooth disease type 1?,Defects in the dopaminergic pathways influencing synaptic plasticity.,"Mutations in the peripheral myelin protein (PMP22) gene, leading to compromised myelin integrity.","Mutations in the SMN1 gene, affecting RNA trafficking and splicing.","Mutations in the voltage-gated ion channels, altering nerve conduction velocity.",text2
How does state-dependent reflex reversal exemplify the modulation of spinal reflex pathways for movement adaptation?,State-dependent reflex reversal diminishes the role of sensory feedback by eliminating the influence of descending inputs on reflex pathways during voluntary movements.,"State-dependent reflex reversal demonstrates that spinal reflex pathways are regulated by descending motor commands to adapt reflexes to different phases of movement, such as switching inhibitory to excitatory actions in the Ib reflex pathways during locomotion.","State-dependent reflex reversal allows spinal reflex pathways to operate independently of any sensory feedback, depending solely on intrinsic circuits for movement regulation.","State-dependent reflex reversal causes permanent changes to spinal reflex pathways, enhancing muscle rigidity and spasticity.",text2
Which molecular adaptation is specifically linked to the development of drug tolerance and withdrawal symptoms in addiction?,Downregulation of dopaminergic neurotransmission across all ventral tegmental area neurons.,Inhibition of voltage-gated calcium channels leading to reduced synaptic transmission.,Upregulation of the cAMP-CREB pathway in response to sustained suppression of the pathway by repeated drug exposure.,Activation of NMDA-type glutamate receptors that enhance synaptic plasticity in prefrontal cortex circuits.,text3
"Which mechanism is most likely responsible for the distribution of cognitive functions across different brain regions, as described in the text?","Complex cognitive tasks are processed by the same set of neurons, which have multifunctional capabilities depending on external stimuli.","Each cognitive function is controlled by a single, large, undifferentiated brain region.",Neurons form a continuous syncytium where all functions are distributed homogeneously across the cortex.,Interactions between multiple specialized processing units that operate in parallel and serially within distinct brain regions.,text4
Which mechanism most likely underlies perceptual stability despite constant saccadic eye movements?,The recruitment of attentional circuits during each saccade to selectively focus on relevant parts of the visual field.,Continuous visual cue adjustments as environmental lighting changes inform the visual system post-saccade.,"The generation of corollary discharge signals that inform the brain about each saccade's vector, allowing adjustment of the visual scene representation.",The activation of muscle spindles in eye muscles providing rapid proprioceptive feedback during saccades.,text3
Which structural feature most significantly differentiates type I synapses from type II synapses in the central nervous system?,Type I synapses have a larger postsynaptic density compared to type II synapses.,Type I synapses exhibit a narrower synaptic cleft compared to type II synapses.,"Type I synapses are characterized by oval synaptic vesicles, while type II synapses have round vesicles.","Type I synapses predominantly occur on axon terminals, whereas type II synapses occur on dendritic spines.",text1
Which mechanism is most likely responsible for the initial establishment of ocular dominance columns in the visual cortex during early development?,Synaptic pruning driven primarily by glial cell activity during synapse elimination.,Competition between axons from the two eyes for synaptic connections on common target neurons.,Exclusive reliance on intrinsic genetic programming to form precise connectivity patterns.,Early synchronous electrical activity in all retinal ganglion cells regardless of eye-related input.,text2
What mechanistic insight is most responsible for the orientation selectivity of neurons in the primary visual cortex?,"The primary visual cortex neurons are inherently tuned to orientation since birth, independent of any synaptic inputs or visual experience.","The convergence of numerous LGN neurons with center-surround receptive fields onto a single V1 neuron forms elongated receptive fields, leading to orientation selectivity.",The orientation selectivity in V1 neurons arises primarily from the inhibitory feedback from the superior colliculus to the visual cortex.,Orientation selectivity in V1 neurons is due to a uniform distribution of retinal ganglion cells evenly across the visual field.,text2
What could be a potential mechanism to enhance brain–machine interface (BMI) performance in subjects with paralysis?,Integrating surrogate somatosensory feedback via cortical electrical microstimulation to improve movement accuracy.,Enhancing arm movement prediction by using longer calibration periods during training.,Increasing the number of EEG electrodes on the scalp for better neural signal capture.,Implementing a purely vision-based control system without neural decoding.,text1
Which hypothesis best explains the role of efferent innervation in vestibular hair cells based on experimental observations?,"Efferent innervation provides direct mechanical support to the hair bundles, aiding in their deflection.",Efferent innervation serves as the sole mechanism for vestibular signal transmission to the central nervous system.,Efferent innervation is primarily responsible for the regeneration of damaged vestibular hair cells.,"Efferent innervation modulates the sensitivity of afferents and hair cells, potentially increasing or decreasing excitability based on context.",text4
Which statement best explains the role of volume transmission in dopamine signaling within the basal ganglia?,Volume transmission specifically targets GABAergic neurons to enhance inhibitory control over basal ganglia output.,Volume transmission ensures that dopamine provides a highly localized and specific signal to individual targeted neurons.,Volume transmission leads to rapid and transient effects by restricting dopamine action to synaptic clefts only.,"Volume transmission allows dopamine to diffuse through extracellular fluid, leading to widespread and imprecise modulation of neural activity across large areas.",text4
Which mechanism is most directly responsible for the retrieval of synaptic vesicle membrane after neurotransmitter release?,Direct reuptake of vesicle membrane through intracellular transport channels.,Fusion of vesicle membrane into the plasma membrane followed by passive diffusion.,Active transport of vesicle membrane involving ATP-dependent ion pumps.,Endocytosis mediated by clathrin-coated pits.,text4
Which mechanism best explains the male-specific preservation of motor neurons in the spinal nucleus of the bulbocavernosus (SNB) during early development?,The male-specific expression of the SRY gene in SNB motor neurons leads to their selective survival during development.,"Testosterone acts on the bulbocavernosus muscles, enhancing their androgen-dependent trophic support to SNB neurons.",Estrogen from the circulation aromatizes in SNB motor neurons to exert neuroprotective effects specific to males.,"Testosterone directly binds to androgen receptors in SNB motor neurons, preventing their apoptosis.",text2
Which of the following steps is not crucial for acetylcholine to be classified as a neurotransmitter according to its classical definition?,The synthesis of acetylcholine in the presynaptic neuron.,The existence of a specific transport mechanism to remove acetylcholine from the synapse.,The presence of a specific degradative enzyme in the postsynaptic cell.,The release of acetylcholine in sufficient amounts to produce an effect on the target cell.,text3
What is the primary reason for employing feedforward control in rapid movements?,"Feedforward control is used in rapid movements due to significant sensory and motor delays, which prevent real-time feedback adjustments.",Feedforward control is preferred for rapid movements because it enhances muscle strength by bypassing sensory feedback.,Feedforward control is employed in rapid movements because it reduces energy expenditure by minimizing neural processing.,Feedforward control is utilized in rapid movements as it allows for increased flexibility in adjusting to unexpected sensory inputs.,text1
Which mechanism is most likely disrupted in the absence of Par family genes during neuronal polarization?,The specialization of distinct cellular processes into a single long axon and multiple dendrites.,The differentiation of neuron cell bodies from neural progenitors.,The generation of neurites as separate entities from the cell body.,The initial formation of cell processes around the cell body.,text1
Which mechanism is most likely responsible for the rapid activation of transduction channels in cochlear hair cells?,Mechanical strain directly opens the transduction channels via gating springs linked to tip links.,Transduction channels are activated through a cascade of second messengers following receptor potential changes.,The vestibular system provides feedback that indirectly influences channel activation in cochlear hair cells.,Ion channels are activated by membrane depolarization due to incoming action potentials.,text1
Which conclusion is best supported by the findings on the role of S-II neurons in tactile processing?,S-II neurons primarily encode vibratory stimuli using phase-locked spike trains to the stimulus cycles.,"S-II neurons integrate contextual memory and tactile signals, differentiating stimulus characteristics based on behavioral context.","S-II neurons are predominantly involved in top-down attentional modulation, independent of tactile input.",S-II neurons simply relay the temporal coding of vibratory stimuli from peripheral receptors without modification.,text2
What key property of the voltage clamp technique allows for the measurement of ion channel conductance across the membrane despite fluctuations in membrane current?,The voltage clamp directly measures ion concentrations inside the cell to compute conductance.,The voltage clamp uses a negative feedback system to maintain a constant membrane potential by adjusting the current across the membrane.,"The voltage clamp locks the membrane at its resting potential, preventing any membrane current.","The voltage clamp removes all ionic currents, allowing only leakage currents to be analyzed.",text2
Which experimental observation best supports the role of ion channels in achieving rapid changes in membrane potential crucial for neuronal signaling?,"Detecting stronger electrostatic interactions between smaller ions and membrane lipids, preventing them from entering lipid bilayers without high energy expenditure.","Increasing ion concentration leading to saturation of current in a manner similar to simple electrodiffusion, indicating linear dependence between current and concentration.","Recording unitary current pulses from membrane channels, indicating rapid ion flow, at rates similar to the turnover rate of the fastest enzymes.",Observing chemical binding of ions to carrier proteins that shuttle ions through the membrane at average rates of 100 ions per second.,text3
"Based on the molecular mechanisms described, which mechanism is most likely responsible for the sensation of slow, gentle touch in hairy skin?",TRPV4 channels mediating normal skin temperature sensations.,TRPV1 channels activated by high temperature stimuli.,Activation of unmyelinated C fibers responding to gentle tactile stimuli.,"Piezo2 channels in Aβ fibers, responsible for rapidly adapting responses.",text3
Which mechanism is primarily responsible for rhythmic locomotion in quadrupeds as described in the source text?,Supraspinal structures directly initiating and regulating all aspects of the locomotor pattern.,Reflexive patterns generated by proprioceptive feedback loops solely in the hindlimbs.,Alternating activation of primary motor cortex regions that sequence muscle contractions.,Central pattern generators in the spinal cord that produce rhythmic activity independent of sensory input.,text4
"Which molecular mechanism is primarily responsible for establishing the dorsoventral patterning of the neural tube, particularly in the spinal cord?","The notochord secretes sonic hedgehog (Shh) protein, inducing the formation of the floor plate, which further secretes Shh to establish a gradient in the ventral region.",Engrailed transcription factors are secreted by the floor plate to determine the identity of interneurons along the dorsoventral axis.,Retinoic acid gradients originating from the paraxial mesoderm are responsible for inducing the dorsal neural tube to form sensory projection neurons.,Bone morphogenetic proteins (BMPs) secreted by the roof plate induce the formation of motor neurons in the dorsal region.,text1
"Based on the current understanding of thermoregulation described in the text, which mechanism most likely explains fever as opposed to simple thermostatic regulation?",Fever is caused by excessive shivering due to a malfunction in the hypothalamic detection of core temperature.,"Fever results from modulation of the afferent/efferent loops, particularly in the hypothalamic preoptic area, due to inhibition of warm-activated GABAergic neurons by prostaglandin E2.","Fever is due to an elevated set point in the body's thermostat, which is adjusted upwards in response to inflammatory signals.",Fever arises from increased sympathetic activation of brown adipose tissue leading to enhanced thermogenesis.,text2
What neural mechanism is most likely involved in the transition of memories from a transient to a durable state?,Short-term memory transitions into long-term memory without involving any specific neural circuits.,Consolidation is primarily dependent on the verbal subsystem in the prefrontal cortex.,Working memory consolidation requires activation of visuospatial subsystems.,Consolidation involves gene expression and synaptic changes.,text4
Which statement best describes the relationship between muscle fiber arrangement and maximal force capacity?,"Muscles with longer fibers generate greater maximal force because they have more sarcomeres in series, enhancing force production.","Muscles with smaller pennation angles have reduced maximal force because fewer fibers can fit into the muscle volume, limiting cross-sectional area.","Muscles with shorter fibers achieve higher forces as they can pack more fibers in series, increasing force output.","Muscles with larger pennation angles have greater maximal force due to more muscle fibers in parallel, allowing for a larger cross-sectional area.",text4
Which principle of sensory coding allows the central nervous system to interpret complex sensory stimuli from simple receptor patterns?,"Sensory neurons make direct connections to cognitive centers, bypassing intermediate cortical processing.",Sequential transmission of unaltered receptor signals to the cortex leads to complex sensory integration.,Parallel processing and combinatorial integration of receptor signals in the cortex transforms simple receptor actions into complex perceptions.,Exact one-to-one correspondence between individual receptor neurons and specific sensory stimuli ensures precise sensory coding.,text3
"Considering the mechanistic processes described in the paragraph, which method would most accurately help in distinguishing between conscious and unconscious cognitive processing in a clinical setting?",Functional neuroimaging that identifies differential brain activation patterns.,Analyzing the duration of response times during cognitive tasks.,Evaluating patient-reported outcomes through subjective questionnaires.,Behavioral observation of task performance in standardized tests.,text1
What mechanism enables neurons in the FM-FM area of the bat auditory cortex to selectively compute target distance using the relationship between emitted sounds and delay of returning echoes?,"The FM-FM area detects target distance by summing Doppler-shifted frequencies, ignoring pulse-echo intervals.","Neurons in the FM-FM region compute target distance solely based on the frequency of echoes, independent of pulse timing.",FM-FM neurons integrate all incoming sounds indiscriminately and rely on subcortical structures for delay-specific responses.,Neurons in the FM-FM area act as feature detectors that respond preferentially to pulse-echo pairs with specific temporal delays corresponding to precise spatial distances.,text4
Which experimental technique allowed Hodgkin and Huxley to demonstrate that voltage-gated Na+ and K+ channels are responsible for the action potential in neurons?,"Magnetic resonance imaging (MRI), which visualizes brain structure and function non-invasively.","The current-clamp technique, which measures the membrane potential changes in response to constant current injection.","The voltage-clamp technique, which allowed precise control of the membrane potential while measuring ionic currents.","The patch-clamp technique, which directly measures currents from individual ion channels.",text3
Which auditory processing feature is unique to the human auditory system as compared to other sensory systems?,"The ability to process sounds from all directions, day and night, including self-generated sounds.",The exclusive use of interaural intensity differences for sound localization.,The reliance on a short-path auditory circuit similar to the visual system.,The use of specialized cortical neurons solely for high-frequency sound recognition.,text1
Which mechanism most accurately explains how the cerebellum adapts motor responses to novel environmental conditions?,The cerebellum enhances excitatory signaling from mossy fibers directly onto deep cerebellar nuclei to improve motor performance in response to error detection.,"The cerebellum utilizes climbing fiber activity to induce long-term depression at synapses between parallel fibers and Purkinje cells, facilitating motor learning by adjusting the output in response to errors.",The cerebellum increases the firing of inhibitory interneurons to adapt motor responses by suppressing erroneous motor commands relayed from the cerebral cortex.,"Motor adaptation occurs in the cerebellum due to increased synaptic efficacy at mossy fiber-granule cell synapses, improving the integration of sensory inputs and motor commands.",text2
Which experimental task design is most effective for distinguishing neural processes related to motor planning from those related to movement execution in cortical areas?,"Instructed-delay motor tasks, which separate planning and execution by introducing a delay between an instructional cue and the movement.","Free-choice tasks, where movements are made spontaneously without predefined instructions, allowing for naturalistic planning.","Reflexive tasks, where automatic responses to stimuli are measured to assess planning processes.","Reaction-time tasks, where a rapid response to a visible cue provides clear separation of planning and execution phases.",text1
"Based on the dual-stream model of language processing, which of the following pathways is primarily responsible for mapping sound to articulation?",The ventral stream is responsible for mapping sound to articulation.,The dorsal stream is responsible for mapping sound to articulation.,Both dorsal and ventral streams equally map sound to articulation.,The sensorimotor cortex independently maps sound to articulation without involving dorsal or ventral streams.,text2
Which of the following provides the best explanation for why central axons regenerate poorly compared to peripheral axons?,Central neurons intrinsically lack the genetic machinery necessary for axonal growth and repair.,Central neurons face environmental barriers such as myelin-associated inhibitors and reactive astrocyte formation that are not present in peripheral nerves.,Central nervous system possesses a higher density of Schwann cells which unfavorably affect regeneration.,"Peripheral nerves are more adept at producing large amounts of NAD, which is essential for axonal regrowth.",text2
"What mechanism primarily contributes to the visual cortex's ability to perceive illusory contours, such as those observed in Kanizsa figures?",Vertical connections between retinal ganglion cells and cortical neurons encode illusory contours directly.,Direct projections from the lateral geniculate nucleus to association areas create the perception of illusory contours.,Horizontal connections between columns of orientation-selective neurons mediate contextual modulation.,Inhibitory feedback from the prefrontal cortex is responsible for generating illusory contour perception.,text3
Which experimental observation best supports the role of the parietal cortex in predictive state estimation during arm movement tasks?,Premovement activity in parietal reach-related neurons suggests processing of centrally generated signals about motor intentions.,Parietal cortex activity increases only after receiving visual feedback regarding arm position.,Lesion studies showing specific deficits in spatial perception without affecting motor execution.,Stimulation of parietal cortex leading to involuntary initiation of complex movement sequences.,text1
Which molecular pathway is primarily responsible for the long-term synaptic changes associated with implicit memory storage in Aplysia?,"The intracellular calcium release pathway, initiated by mGluR activation, leading to synaptic changes.",The direct activation of NMDA receptors which leads to immediate changes in synaptic strength.,"The cAMP-PKA-CREB pathway, which involves the activation of PKA by cAMP and subsequent gene expression changes mediated by CREB.","The GABAergic pathway, where increased inhibition leads to long-term potentiation of synapses.",text3
Which hypothalamic mechanism is primarily responsible for modulating vasopressin release in response to dehydration?,Projection from the suprachiasmatic nucleus to the lateral hypothalamus to regulate circadian rhythms of fluid intake.,Inhibition of satiety neurons in the arcuate nucleus to stimulate water-seeking behavior.,Stimulation of thermoregulatory neurons in the preoptic area causing panting and increased thirst.,Activation of osmoreceptors in the vascular organ of the lamina terminalis and connections to the supraoptic nucleus.,text4
