question,text1,text2,text3,text4,label
Which factor has been proposed to significantly contribute to the secular increase in autism spectrum disorders (ASD) prevalence?,"The widespread use of vaccinations in children, despite lack of supporting evidence.","The increased paternal age, which correlates with a higher rate of de novo mutations.",A substantial increase in environmental pollution leading to genetic mutations.,"A rise in the incidence of infectious diseases among pregnant women, affecting fetal development.",text2
Which statement about the amygdala's involvement in fear processing is best supported by current research?,The amygdala's involvement in fear is primarily limited to auditory cues and does not extend to visual stimuli.,Damage to the amygdala leads to an enhanced rather than reduced experience of fear.,The amygdala is critical for both the emotional processing of conditioned fear and the autonomic responses to such stimuli.,The amygdala is solely involved in processing positive emotions and has no role in fear.,text3
"Which of the following statements best explains the role of the cAMP-CREB pathway in drug addiction, based on chronic drug exposure?","Acute exposure to opioids permanently reduces cAMP levels, which eliminates the potential for developing drug tolerance.",The CREB protein is only implicated in the initial stages of drug exposure and does not affect long-term addiction processes.,"Chronic drug exposure leads to upregulation and increased activity of the cAMP-CREB pathway, contributing to drug tolerance and dependence.","The cAMP-CREB pathway is directly inhibited during chronic drug exposure, leading to decreased neuronal activity and reduced addiction behaviors.",text3
Which mechanism is most likely responsible for the generation of paroxysmal spikes observed in the electroencephalogram (EEG) during a seizure?,Isolated action potentials in single neurons whose voltage changes are directly recorded by EEG.,Random and unsynchronized firing of neurons across the cortex.,Alpha wave synchronization occurring momentarily during relaxed wakefulness.,Synchronous activity of neuronal ensembles leading to large field potentials.,text4
Which mechanism best explains the ability of cerebellum to learn specific temporal sequences in motor tasks such as delay eyeblink conditioning?,The convergence of diverse input signals onto the cerebellar nuclear cells to integrate temporal patterns from sensory stimuli.,The synaptic plasticity at granule cell to Purkinje cell synapses triggered by climbing fiber inputs signaling aversive stimuli.,The direct encoding of temporal sequences by the single powerful input from the inferior olive to each Purkinje cell.,The modulation of Purkinje cell firing rates by feedback loops from the spinal cord during motor task execution.,text2
Which mechanism is most likely responsible for maintaining postural equilibrium when a person's center of mass moves beyond the base of support?,Suppressing vestibular inputs to avoid disorientation during shifting movements.,Increasing muscle tension uniformly throughout the body to stabilize all joints.,Enhancing visual fixation on a stable target to reduce compensatory sway.,Using momentum and counter-rotations of body segments to realign the ground reaction force and return the center of mass over the base of support.,text4
Which mechanism is most likely responsible for the ability of growth cones to navigate towards synaptic targets?,Interaction of environmental cues with growth cone receptors leading to cytoskeletal reorganization.,Intrinsic transcriptional programs that autonomously direct axonal pathfinding.,Mechanical guidance from extracellular matrix rigidity and friction.,Electrical activity across growth cones establishing pathways through resonance.,text1
"Considering the principles of neurovascular coupling, which explanation most accurately describes the process by which neuronal activity leads to changes in fMRI signals?","Active neurons increase metabolic demand, which leads to a temporary rise in local blood oxygenation levels and consequently increases the fMRI BOLD signal.","Neuronal activity triggers immediate neuronal firing in the area, which directly alters fMRI measurements through increased electrical conductivity.","Increased neuronal firing raises local deoxygenated blood concentration, which inversely elevates the fMRI signal via enhanced proton resonance.","Active neurons directly manipulate the alignment of protons in the MRI magnetic field, creating BOLD signal fluctuations.",text1
What is the primary function of acetylcholinesterase located in the synaptic cleft of the neuromuscular junction?,To enhance the binding affinity of acetylcholine for its receptor.,To mediate the entry of calcium ions into the muscle fiber.,"To hydrolyze acetylcholine, thereby terminating its action at the receptor.",To facilitate the fusion of synaptic vesicles with the presynaptic membrane.,text3
Which of the following accurately describes the factors that determine the resting membrane potential in neurons?,The resting membrane potential is constantly fluctuating due to random opening and closing of all types of ion channels in the neuron.,"The resting membrane potential only depends on the active transport of ions by sodium-pump ATPase, without contribution from passive ion channels.",The resting membrane potential is primarily determined by the passive flux of ions through selectively permeable ion channels and the relative concentrations of these ions across the membrane.,The resting membrane potential is solely determined by the concentration of calcium ions inside and outside the neuron.,text3
Which neural mechanism likely contributes to the rapid adaptation of postural responses when transitioning from standing to sitting positions?,The vestibulocerebellum integrates visual and somatosensory information to adjust postural strategies.,The cerebral cortex anticipates voluntary movements and generates postural adjustments accordingly.,The basal ganglia facilitates the quick switching of postural set to accommodate new initial conditions.,The spinocerebellum adapts the magnitude of postural responses based on immediate sensory feedback.,text3
Which molecular mechanism is most likely responsible for the maintenance of synaptic specificity between axons and their target neurons in the retinotopic map of the visual system?,Laminar specificity alone is sufficient to maintain synaptic specificity without the need for further molecular interactions.,Synaptic specificity is maintained solely by retrograde signaling from post-synaptic cells to axons following initial contact.,"Molecular cues, such as ephrins and Eph kinases, initially establish a crude map, which is refined through activity-dependent processes.",Specific transcription factors are activated post-synaptically to reorganize axonal projections independent of synaptic activity.,text3
Which feature of visual processing in the retina enables the detection of subtle spatial and temporal changes in the visual environment?,The uniform distribution of photoreceptors across the retina ensures consistent sensitivity to all spectral wavelengths.,The synchronous firing of retinal ganglion cells represents complex visual scenes through a single-cell coding mechanism.,The high density of rod photoreceptors in the fovea provides acute spatial resolution of static scenes.,The opposition between center and surround responses in receptive fields emphasizes contrast and movement.,text4
"Which aspect of neural circuit organization primarily supports complex behaviors, such as hitting a tennis ball, by integrating sensory inputs for motor execution?",Independent processing of visual and motor information without integration.,Relaying sensory inputs through the thalamus without involvement of cortical circuits.,"Hierarchical processing and integration of sensory inputs at multiple levels, including cortical and subcortical networks.",Direct sensory input from the retina to motor neurons in the spinal cord.,text3
Which symptom would most likely indicate a complete lesion of the oculomotor nerve (cranial nerve III)?,The pupil becomes constricted and the eyelid shows partial ptosis on the affected side.,The eye experiences vertical misalignment that worsens with a head tilt towards the affected side.,"The eye is deviated downward and abducted, and there is a drooping eyelid.","The eye cannot abduct beyond the midline, leading to increased diplopia when looking towards the affected side.",text3
"Considering the functional organization of neurons in the knee-jerk reflex, what is the principal role of convergence at the sensory-motor synapse?",Convergence serves primarily to amplify the receptor potential generated by the muscle spindle stretches.,Convergence allows the integration of inputs from multiple sensory neurons to ensure sufficient activation of the motor neuron.,Convergence in the knee-jerk reflex prevents sensory neurons from directly inhibiting opposing muscle groups.,Convergence helps in evenly distributing the signal from one sensory neuron to multiple motor neurons.,text2
What is the primary role of the SRY gene in the process of sexual differentiation in humans?,"The SRY gene activates the production of estrogen, leading to the development of female characteristics.","The SRY gene suppresses the functions of the X chromosome, leading to male brain development.",The SRY gene initiates the development of male gonadal differentiation by directing the undifferentiated gonads to become testes.,"The SRY gene determines the chromosomal inactivation process in female cells, preventing the expression of Y-linked genes.",text3
What role do slowly adapting mechanoreceptors (SA1 and SA2 fibers) in the hand primarily play in tactile perception?,"SA1 fibers signal skin deformation and pressure, providing information about the compliance, shape, size, and surface texture of objects, while SA2 fibers primarily respond to skin stretch and aid in perceiving hand shape and finger position.",Both SA1 and SA2 fibers are used primarily to detect superficial surface textures rather than deeper geometric features of objects.,"SA1 fibers are mainly responsible for detecting vibrations from tools, whereas SA2 fibers are sensitive to rapid changes in temperature across the skin surface.","SA1 fibers are exclusively responsible for perceiving tactile motion, while SA2 fibers predominantly convey temperature information.",text1
What molecular mechanism is primarily responsible for the radial migration of neurons in the developing cerebral cortex?,The enclosure of neuronal nuclei in a protective extracellular matrix facilitating migration.,The formation of growth cones on neurons that guide them through radial glial cells.,The interaction of migrating neurons with radial glial scaffolds through integrin-mediated adhesion.,The presence of morphogens like Sonic Hedgehog that create a gradient for migration.,text3
Which factor might be primarily responsible for the synaptic pruning abnormalities observed in schizophrenia during adolescence?,Genetic variants that influence synaptic functions and plasticity.,Environmental toxins primarily affecting brain stem development.,Excessive neuronal apoptosis due to mitochondrial dysfunction.,Early life malnutrition affecting blood-brain barrier integrity.,text1
Which mechanism best explains the role of the ventral midbrain dopaminergic pathways in modulating motivational states?,"Dopaminergic pathways in the ventral midbrain inhibit the activity of the limbic system, thereby reducing the influence of emotional stimuli on motivation.","Ventral midbrain dopaminergic pathways stimulate the thalamus directly, which in turn modulates arousal levels that affect motivational behavior.","The ventral midbrain dopaminergic pathways primarily enhance sensory signal detection in the cortex, indirectly affecting motivational states through sensory processing.","The ventral midbrain dopaminergic pathways connect the midbrain to the limbic system and cortex, facilitating the processing of reinforcement-related stimuli and expectation of rewards, thus influencing motivational states.",text4
What would be the most likely effect of genetic deletion of the NR1 subunit of NMDA receptors specifically in CA1 pyramidal neurons on spatial memory and related synaptic function?,Long-term potentiation in CA1 would be abolished but spatial memory remains unaffected.,The deletion would have no effect on spatial memory but enhance non-spatial memory tasks.,Spatial memory would be significantly impaired due to disrupted LTP at Schaffer collateral synapses.,Spatial memory would enhance due to increased synaptic transmission.,text3
What would be the most likely consequence of introducing mutations that prevent RNA editing of the GluA2 gene in AMPA receptor function?,Enhanced AMPA receptor-mediated synaptic plasticity and memory formation.,Reduced ligand-binding ability causing impaired synaptic transmission.,Increased calcium permeability leading to excitotoxicity and early onset seizures.,Decreased excitatory neurotransmission due to loss of AMPA receptor surface expression.,text3
"In a motor unit, what determines the synchronization and timing of muscle fiber action potentials following nerve activation?",Synchronization is achieved through gap junctions between muscle fibers in a motor unit.,The timing of action potentials in muscle fibers is governed by local chemical gradients rather than nerve signals.,The action potential of the motor neuron triggers synchronized action potentials in all its innervated muscle fibers.,Each muscle fiber generates action potentials independently based on its own membrane excitability.,text3
Which cognitive function is most heavily associated with the role of persistent neural activity in the higher-order association cortices?,Maintaining a provisional plan of action or strategy based on accumulated evidence.,Directly encoding sensory stimuli through continuous updates.,Storing long-term memories independently of sensory input.,Facilitating random motor outputs without evidence-based influence.,text1
Which mechanism is most likely responsible for face recognition impairment following temporal lobe damage?,Loss of long-range horizontal connections affecting global contour integration.,Impairment of the primary visual cortex affecting object segmentation.,Selective damage to the regions responsible for basic visual attributes like color and motion.,Disruption in functionally specialized face-processing areas in the temporal cortex.,text4
What mechanism is primarily responsible for the enhanced excitability of dorsal horn neurons during central sensitization?,Inhibition of NMDA receptors by GABAergic interneurons leading to reduced transmission of noxious signals.,Increased release of glutamate from Aδ fiber terminals results in prolonged excitation of AMPA receptors.,Activation of NMDA receptors due to removal of Mg2+ block and calcium influx upon C fiber stimulation.,"Activation of potassium channels that hyperpolarize the dorsal horn neurons, reducing excitability.",text3
"Which experimental strategy is most appropriate to validate a gene's role in a specific behavior in mice, given strong evidence from Drosophila studies?",Introduce a transgene from Drosophila into the mouse genome to assess conservation of function.,Use reverse genetics to create a knockout mouse model for the gene and observe changes in behavior.,Apply random mutagenesis in mice to screen for spontaneous behavioral phenotypes.,Use pharmacological agents to modulate the corresponding signaling pathway in adult mice.,text2
