Description A,Judge A,Description B,Judge B,Answer,Chapter,Book,Version
"The MECP2 gene product binds to methylated cytosine bases in DNA, regulating gene expression.",True,"The MECP2 gene product binds to unmethylated cytosine bases in DNA, regulating gene expression.",False,Description A,221,PrincipleNeuralScience,1.0
"Williams syndrome occurs in 1 in 10,000 live births.",True,"Williams syndrome occurs in 1 in 20,000 live births.",False,Description A,221,PrincipleNeuralScience,1.0
Loss of function of the UBE3A gene on the maternal chromosome leads to Angelman syndrome.,True,Loss of function of the UBE3A gene on the paternal chromosome leads to Angelman syndrome.,False,Description A,221,PrincipleNeuralScience,1.0
The neuromuscular junction abnormalities in myasthenia gravis include reduced numbers of ACh receptors.,True,The neuromuscular junction abnormalities in myasthenia gravis include increased numbers of ACh receptors.,False,Description A,222,PrincipleNeuralScience,1.0
Acetylcholinesterase inhibitors can ameliorate symptoms in myasthenia gravis by prolonging the action of acetylcholine.,True,Acetylcholinesterase inhibitors worsen symptoms in myasthenia gravis by shortening the action of acetylcholine.,False,Description A,222,PrincipleNeuralScience,1.0
"In Lambert-Eaton syndrome, the first postsynaptic potential is abnormally small, but subsequent responses increase in amplitude.",True,"In Lambert-Eaton syndrome, the first postsynaptic potential is abnormally large, but subsequent responses decrease in amplitude.",False,Description A,222,PrincipleNeuralScience,1.0
Duchenne muscular dystrophy affects only males as it is transmitted as an X-linked recessive trait.,True,Duchenne muscular dystrophy affects both males and females equally as it is transmitted as an X-linked recessive trait.,False,Description A,222,PrincipleNeuralScience,1.0
The slow channel syndrome is characterized by prominent limb weakness with little weakness of cranial muscles.,True,The slow channel syndrome is characterized by prominent cranial muscle weakness with little weakness of limb muscles.,False,Description A,222,PrincipleNeuralScience,1.0
Dermatomyositis is defined by two clinical features: rash and myopathy.,True,"Dermatomyositis is defined by three clinical features: rash, myopathy, and neuropathy.",False,Description A,222,PrincipleNeuralScience,1.0
The mutations in the slow channel syndrome increase the affinity of the nicotinic ACh receptor for acetylcholine.,True,The mutations in the slow channel syndrome decrease the affinity of the nicotinic ACh receptor for acetylcholine.,False,Description A,222,PrincipleNeuralScience,1.0
"In congenital myasthenia, the infant has an inherited defect in some component of the neuromuscular junction.",True,"In congenital myasthenia, the infant has an acquired defect in some component of the neuromuscular junction.",False,Description A,222,PrincipleNeuralScience,1.0
"The fast channel syndrome can respond to either acetylcholinesterase inhibitors or 3,4-diaminopyridine.",True,"The fast channel syndrome can respond to neither acetylcholinesterase inhibitors nor 3,4-diaminopyridine.",False,Description A,222,PrincipleNeuralScience,1.0
Becker muscular dystrophy is typically milder than Duchenne because dystrophin is present but may be abnormal.,True,Becker muscular dystrophy is typically more severe than Duchenne because dystrophin is absent entirely.,False,Description A,222,PrincipleNeuralScience,1.0
Plasmapheresis involves filtering the plasma and can be beneficial for myasthenia gravis patients.,True,Plasmapheresis involves adding antibodies to the plasma and can be beneficial for myasthenia gravis patients.,False,Description A,222,PrincipleNeuralScience,1.0
"In congenital myasthenia, end-plate currents are slow to decay, causing prolonged muscle potential response.",True,"In congenital myasthenia, end-plate currents are fast to decay, causing decreased muscle potential response.",False,Description A,222,PrincipleNeuralScience,1.0
Lambert-Eaton syndrome is often associated with small-cell lung cancer.,True,Lambert-Eaton syndrome is rarely associated with small-cell lung cancer.,False,Description A,222,PrincipleNeuralScience,1.0
Dystrophin confers tensile strength to the muscle cell by linking it to the extracellular matrix.,True,Dystrophin confers tensile strength to the muscle cell by preventing it from linking to the extracellular matrix.,False,Description A,222,PrincipleNeuralScience,1.0
"Botulinum toxin impairs the release of acetylcholine from nerve terminals, causing neuromuscular block.",True,"Botulinum toxin increases the release of acetylcholine from nerve terminals, causing neuromuscular block.",False,Description A,222,PrincipleNeuralScience,1.0
Marmoset monkeys exhibit human-like pitch perception and can discriminate a missing fundamental in harmonic sounds with a precision as small as one semitone for periodicity above 440 Hz.,True,Marmoset monkeys exhibit human-like pitch perception and can discriminate a missing fundamental in harmonic sounds with a precision as small as one semitone for periodicity above 200 Hz.,False,Description A,223,PrincipleNeuralScience,1.0
The pitch-selective neurons in marmoset monkeys are located at the low-frequency border between A1 and the rostral auditory cortex (area R).,True,The pitch-selective neurons in marmoset monkeys are located at the high-frequency border between A1 and the rostral auditory cortex (area R).,False,Description A,223,PrincipleNeuralScience,1.0
The perception of the missing fundamental remains robust despite the loss of some harmonic components.,True,The perception of the missing fundamental is highly fragile and becomes distorted with the loss of some harmonic components.,False,Description A,223,PrincipleNeuralScience,1.0
Human imaging studies have identified a region at the lateral end of Heschl’s gyrus that mirrors the pitch center location in marmoset monkeys.,True,Human imaging studies have identified a region at the medial end of Heschl’s gyrus that mirrors the pitch center location in marmoset monkeys.,False,Description A,223,PrincipleNeuralScience,1.0
Pitch-selective neurons in marmosets respond to pitch-evoking sounds like harmonic sounds and click trains.,True,Pitch-selective neurons in marmosets do not respond to pitch-evoking sounds like harmonic sounds and click trains.,False,Description A,223,PrincipleNeuralScience,1.0
"Harmonic template neurons are distributed across A1 and R, covering the entire hearing range of marmosets, from approximately 1 kHz to 32 kHz.",True,"Harmonic template neurons are confined to a narrow region of A1, covering only a range from approximately 1 kHz to 5 kHz.",False,Description A,223,PrincipleNeuralScience,1.0
Xiaoqin Wang and colleagues discovered pitch-selective neurons in marmosets about a decade ago.,True,Xiaoqin Wang and colleagues discovered pitch-selective neurons in marmosets two decades ago.,False,Description A,223,PrincipleNeuralScience,1.0
Pitch-selective neurons increase their firing rates as the behavioral salience of pitch increases.,True,Pitch-selective neurons decrease their firing rates as the behavioral salience of pitch increases.,False,Description A,223,PrincipleNeuralScience,1.0
The core regions of auditory cortex in marmosets also contain a class of harmonic template neurons.,True,"The core regions of auditory cortex in marmosets contain only pitch-selective neurons, not harmonic template neurons.",False,Description A,223,PrincipleNeuralScience,1.0
Pitch carries crucial linguistic information in tonal languages such as Chinese.,True,Pitch is irrelevant to linguistic information in tonal languages such as Chinese.,False,Description A,223,PrincipleNeuralScience,1.0
Pitch allows harmonically structured periodic sounds to be perceived and ordered on a musical scale.,True,Pitch does not allow harmonically structured periodic sounds to be perceived and ordered on a musical scale.,False,Description A,223,PrincipleNeuralScience,1.0
Monkeys are capable of spectral pitch discrimination and melody recognition.,True,Monkeys are incapable of spectral pitch discrimination and melody recognition.,False,Description A,223,PrincipleNeuralScience,1.0
"When listening to an orchestra, we hear the melody of the soloist over the background of accompanying instruments.",True,"When listening to an orchestra, we cannot hear the melody of the soloist over the background of accompanying instruments.",False,Description A,223,PrincipleNeuralScience,1.0
"Birds, cats, and monkeys can also pick out pitch like humans.",True,"Birds, cats, and monkeys cannot pick out pitch like humans.",False,Description A,223,PrincipleNeuralScience,1.0
The slowing of the phase-locking limit along the ascending auditory pathway is necessary for auditory information integration in the cerebral cortex.,True,The slowing of the phase-locking limit along the ascending auditory pathway is irrelevant for auditory information integration in the cerebral cortex.,False,Description A,223,PrincipleNeuralScience,1.0
"Nerve growth factor (NGF) binds to TrkA receptors on primary nociceptive terminals, triggering upregulation in expression of ion channels that increase nociceptor excitability.",True,"Nerve growth factor (NGF) binds to TrkA receptors on primary nociceptive terminals, reducing expression of ion channels that decrease nociceptor excitability.",False,Description A,224,PrincipleNeuralScience,1.0
Retrograde transport of signaling endosomes enhances expression of brain-derived neurotrophic factor (BDNF).,True,Retrograde transport of signaling endosomes suppresses expression of brain-derived neurotrophic factor (BDNF).,False,Description A,224,PrincipleNeuralScience,1.0
Central sensitization decreases pain thresholds (allodynia) and can lead to spontaneous pain in the absence of peripheral stimulation.,True,Central sensitization increases pain thresholds (allodynia) and eliminates spontaneous pain in the absence of peripheral stimulation.,False,Description A,224,PrincipleNeuralScience,1.0
"Peripheral nerve damage decreases GABAergic inhibitory controls, exacerbating hyperactivity of nociceptive pathways in the dorsal horn.",True,"Peripheral nerve damage increases GABAergic inhibitory controls, reducing hyperactivity of nociceptive pathways in the dorsal horn.",False,Description A,224,PrincipleNeuralScience,1.0
"Peripheral nerve injury activates microglia, which release mediators that reduce inhibitory controls exerted by GABAergic interneurons.",True,"Peripheral nerve injury activates microglia, which release mediators that increase inhibitory controls exerted by GABAergic interneurons.",False,Description A,224,PrincipleNeuralScience,1.0
Mechanical allodynia can involve inappropriate engagement of dorsal horn nociceptive pathways by Aβ myelinated afferents.,True,Mechanical allodynia typically involves appropriate engagement of dorsal horn nociceptive pathways by uninjured nociceptors.,False,Description A,224,PrincipleNeuralScience,1.0
NMDA receptor activation in the dorsal horn contributes to central sensitization and increased excitability of dorsal horn neurons.,True,NMDA receptor activation in the dorsal horn reduces central sensitization and decreases excitability of dorsal horn neurons.,False,Description A,224,PrincipleNeuralScience,1.0
"Activation of NK1 receptors by C fibers generates long-lasting cumulative depolarization in dorsal horn neurons, contributing to central sensitization.",True,Activation of NK1 receptors by C fibers generates transient depolarization that inhibits central sensitization.,False,Description A,224,PrincipleNeuralScience,1.0
"Under normal conditions, large-diameter, nonnociceptive Aβ afferent fibers activate GABAergic interneurons in the dorsal horn to inhibit pain transmission circuits.",True,"Under normal conditions, large-diameter, nonnociceptive Aβ afferent fibers deactivate GABAergic interneurons in the dorsal horn, promoting pain transmission circuits.",False,Description A,224,PrincipleNeuralScience,1.0
Loss of GABAergic interneurons due to peripheral nerve injury reduces inhibitory control and contributes to Aβ-mediated mechanical hypersensitivity.,True,Loss of GABAergic interneurons due to peripheral nerve injury increases inhibitory control and reduces Aβ-mediated mechanical hypersensitivity.,False,Description A,224,PrincipleNeuralScience,1.0
"Elevation of residual Ca2+ in presynaptic terminals increases the release of glutamate and substance P, contributing to dorsal horn neuron excitability.",True,"Elevation of residual Ca2+ in presynaptic terminals decreases the release of glutamate and substance P, reducing dorsal horn neuron excitability.",False,Description A,224,PrincipleNeuralScience,1.0
Activation of postsynaptic NMDA receptors in dorsal horn neurons results in long-lasting depolarization and increased neural excitability.,True,Activation of postsynaptic NMDA receptors in dorsal horn neurons results in short-lasting hyperpolarization and decreased neural excitability.,False,Description A,224,PrincipleNeuralScience,1.0
Second-messenger systems influenced by NK1 receptors enhance the performance of NMDA receptors during dorsal horn sensitization.,True,Second-messenger systems influenced by NK1 receptors inhibit the performance of NMDA receptors during dorsal horn sensitization.,False,Description A,224,PrincipleNeuralScience,1.0
Peripheral nerve injury can lead to inappropriate engagement of dorsal horn projection neurons by Aβ afferents.,True,Peripheral nerve injury prevents engagement of dorsal horn projection neurons by Aβ afferents.,False,Description A,224,PrincipleNeuralScience,1.0
Microglial cell activation in the dorsal horn releases mediators that enhance excitability and reduce GABAergic inhibition.,True,Microglial cell activation in the dorsal horn releases mediators that suppress excitability and restore GABAergic inhibition.,False,Description A,224,PrincipleNeuralScience,1.0
"The inability to mentalize, or 'mind blindness,' was first tested in children with autism using a simple puppet game, the Sally-Anne test.",True,"The inability to mentalize, or 'mind blindness,' was first tested in children with autism using a complex mathematical game, the Sally-Anne test.",False,Description A,225,PrincipleNeuralScience,1.0
The Sally-Anne test involves Sally putting a ball into her basket before leaving the room.,True,The Sally-Anne test involves Sally putting a ball into her box before leaving the room.,False,Description A,225,PrincipleNeuralScience,1.0
Children with Down syndrome typically pass the Sally-Anne test at a younger age than children with autism.,True,Children with Down syndrome typically do not pass the Sally-Anne test at a younger age than children with autism.,False,Description A,225,PrincipleNeuralScience,1.0
The inferior temporal cortex within the fusiform gyrus is involved in face processing.,True,The superior temporal sulcus is involved in face processing.,False,Description A,225,PrincipleNeuralScience,1.0
The orbitofrontal cortex is implicated in social deficits in autism.,True,The cerebellum is implicated in social deficits in autism.,False,Description A,225,PrincipleNeuralScience,1.0
Functional MRI studies have shown that activity in the mentalizing network is reduced in subjects with ASD.,True,Functional MRI studies have shown that activity in the mentalizing network is increased in subjects with ASD.,False,Description A,225,PrincipleNeuralScience,1.0
The amygdala is involved in the evaluation of social and nonsocial information for indications of danger in the environment.,True,The posterior parietal cortex is involved in the evaluation of social and nonsocial information for indications of danger in the environment.,False,Description A,225,PrincipleNeuralScience,1.0
The medial prefrontal cortex is involved in monitoring one's own thoughts.,True,The supplementary motor area is involved in monitoring one's own thoughts.,False,Description A,225,PrincipleNeuralScience,1.0
It is thought that mentalizing is impaired in ASD with profound effects on social development.,True,It is thought that mentalizing is enhanced in ASD with profound effects on social development.,False,Description A,225,PrincipleNeuralScience,1.0
Face processing involves a region of the inferior temporal cortex within the fusiform gyrus.,True,Face processing involves a region of the superior temporal sulcus.,False,Description A,225,PrincipleNeuralScience,1.0
Young children with ASD show excellent appreciation of physical causes and events.,True,Young children with ASD show poor appreciation of physical causes and events.,False,Description A,225,PrincipleNeuralScience,1.0
Autism Spectrum Disorder Phenotypes Also Share Distinctive Cognitive Abnormalities.,True,Autism Spectrum Disorder Phenotypes Share No Cognitive Abnormalities.,False,Description A,225,PrincipleNeuralScience,1.0
Variations of the Sally-Anne test have been used with children and adults with ASD since the mid-1980s.,True,Variations of the Sally-Anne test have been used with children and adults with ASD since the early 1970s.,False,Description A,225,PrincipleNeuralScience,1.0
"From birth, normal infants prefer to attend to people rather than other stimuli.",True,"From birth, normal infants prefer to attend to inanimate objects rather than people.",False,Description A,225,PrincipleNeuralScience,1.0
Insight into the mental state of others depends on the capacity to mentalize spontaneously.,True,Insight into the mental state of others depends on the capacity to mentalize effortfully.,False,Description A,225,PrincipleNeuralScience,1.0
Neurons born in the germinal zone of the dentate gyrus in adult rodents are integrated into hippocampal circuits.,True,Neurons born in the germinal zone of the dentate gyrus in adult rodents cannot be integrated into hippocampal circuits.,False,Description A,226,PrincipleNeuralScience,1.0
"Neurogenesis in the adult brain was initially met with skepticism, but later confirmed with improved technologies.",True,Neurogenesis in the adult brain was widely accepted immediately without skepticism.,False,Description A,226,PrincipleNeuralScience,1.0
Adult-born neurons are generated near the surface of the lateral ventricles and migrate to the olfactory bulb.,True,Adult-born neurons are generated in the olfactory bulb and migrate to the lateral ventricles.,False,Description A,226,PrincipleNeuralScience,1.0
Adult neurogenesis can be influenced by environmental factors such as enrichment and physical activity.,True,Adult neurogenesis is unaffected by environmental factors such as enrichment and physical activity.,False,Description A,226,PrincipleNeuralScience,1.0
New neurons in the adult brain are highly similar to those born at embryonic stages.,True,New neurons in the adult brain are completely dissimilar to those born at embryonic stages.,False,Description A,226,PrincipleNeuralScience,1.0
The generation of new neurons in adults is linked to certain behaviors mediated by the olfactory bulb and hippocampus.,True,The generation of new neurons in adults has no link to behaviors mediated by the olfactory bulb and hippocampus.,False,Description A,226,PrincipleNeuralScience,1.0
Joseph Altman discovered neurogenesis continues into adulthood in some parts of the mammalian brain in the 1960s.,True,Joseph Altman discovered neurogenesis stops completely before adulthood in all parts of the mammalian brain.,False,Description A,226,PrincipleNeuralScience,1.0
New neurons are added to the adult olfactory bulb and form functional circuits.,True,New neurons are added to the adult olfactory bulb but do not form functional circuits.,False,Description A,226,PrincipleNeuralScience,1.0
Stem cells are the source of neurons in the adult as well as the embryo.,True,"Stem cells are not the source of neurons in the adult, only in the embryo.",False,Description A,226,PrincipleNeuralScience,1.0
"In the hematopoietic system, a few stem cells can repopulate the entire adaptive immune system.",True,"In the hematopoietic system, a few stem cells cannot repopulate the entire adaptive immune system.",False,Description A,226,PrincipleNeuralScience,1.0
Neuronal death is a frequent consequence of neural insults such as stroke and neurodegenerative disease.,True,Neuronal death is rare following neural insults such as stroke and neurodegenerative disease.,False,Description A,226,PrincipleNeuralScience,1.0
Transplantation of developing neurons into experimental animals has shown promising results in reversing effects of injury.,True,Transplantation of developing neurons into experimental animals has never shown promising results.,False,Description A,226,PrincipleNeuralScience,1.0
Stem cells in adulthood are derived from radial glia.,True,Stem cells in adulthood are not derived from radial glia.,False,Description A,226,PrincipleNeuralScience,1.0
Neurogenesis in adult animals can be decreased in models of depression and chronic stress.,True,Neurogenesis in adult animals remains unchanged in models of depression and chronic stress.,False,Description A,226,PrincipleNeuralScience,1.0
"Neurons born at embryonic stages are gradually replaced by later-born neurons, maintaining their total number.",True,Neurons born at embryonic stages are never replaced by later-born neurons.,False,Description A,226,PrincipleNeuralScience,1.0
Pierre Paul Broca discovered that damage to the posterior portion of the left frontal lobe (Broca’s area) produces a specific deficit in language.,True,Pierre Paul Broca discovered that damage to the posterior portion of the left frontal lobe (Broca’s area) enhances language capabilities.,False,Description A,227,PrincipleNeuralScience,1.0
Episodic memory involves interactions between the medial temporal lobe and association cortices.,True,Episodic memory involves interactions between the occipital lobe and association cortices.,False,Description A,227,PrincipleNeuralScience,1.0
Operant conditioning involves associating a specific behavior with a reinforcing event.,True,Operant conditioning involves associating a specific behavior with a non-reinforcing event.,False,Description A,227,PrincipleNeuralScience,1.0
The Hippocampus supports episodic memory by building relational associations.,True,The Hippocampus disrupts episodic memory by breaking relational associations.,False,Description A,227,PrincipleNeuralScience,1.0
Short-term memory maintains transient representations of information relevant to immediate goals.,True,Short-term memory maintains permanent representations of information relevant to long-term goals.,False,Description A,227,PrincipleNeuralScience,1.0
"Memory involves encoding, storage, retrieval, and consolidation.",True,"Memory involves only encoding and retrieval, but not storage and consolidation.",False,Description A,227,PrincipleNeuralScience,1.0
Implicit memory supports a range of behaviors in humans and animals.,True,Implicit memory supports only a narrow range of behaviors specific to humans.,False,Description A,227,PrincipleNeuralScience,1.0
Short-term memory is selectively transferred to long-term memory.,True,Short-term memory automatically transfers all information to long-term memory without selection.,False,Description A,227,PrincipleNeuralScience,1.0
Errors and imperfections in memory shed light on normal memory processes.,True,Errors and imperfections in memory have no relevance to understanding normal memory processes.,False,Description A,227,PrincipleNeuralScience,1.0
Working memory consists of at least two subsystems: one for verbal information and another for visuospatial information.,True,Working memory consists of a single unified system for all types of information.,False,Description A,227,PrincipleNeuralScience,1.0
The medial temporal lobe is critical for episodic long-term memory.,True,The medial temporal lobe is irrelevant for episodic long-term memory.,False,Description A,227,PrincipleNeuralScience,1.0
Memory storage involves many different parts of the brain.,True,Memory storage is confined to a single part of the brain.,False,Description A,227,PrincipleNeuralScience,1.0
Phonological storage partially depends on articulatory processes in Broca’s area.,True,Phonological storage has no dependency on articulatory processes in Broca’s area.,False,Description A,227,PrincipleNeuralScience,1.0
Working memory involves activation of representations of information stored in specialized cortical regions.,True,Working memory functions independently of representations in specialized cortical regions.,False,Description A,227,PrincipleNeuralScience,1.0
Executive control processes in working memory allocate attentional resources to the verbal and visuospatial subsystems.,True,Executive control processes in working memory do not interact with verbal or visuospatial subsystems.,False,Description A,227,PrincipleNeuralScience,1.0
The relative proportion of hybrid fibers in a muscle increases with age.,True,The relative proportion of hybrid fibers in a muscle decreases with age.,False,Description A,228,PrincipleNeuralScience,1.0
Physical activity has little effect on the composition of a muscle's fibers.,True,Physical activity drastically changes the composition of a muscle's fibers.,False,Description A,228,PrincipleNeuralScience,1.0
Strength training can increase the size of type I fibers by 0% to 20%.,True,Strength training can decrease the size of type I fibers by 0% to 20%.,False,Description A,228,PrincipleNeuralScience,1.0
Endurance training increases the enzyme activities of oxidative metabolic pathways.,True,Endurance training decreases the enzyme activities of oxidative metabolic pathways.,False,Description A,228,PrincipleNeuralScience,1.0
