Description A,Judge A,Description B,Judge B,Answer,Chapter,Book,Version
Bed rest or limb immobilization decreases the size and intrinsic force capacity of muscle fibers.,True,Bed rest or limb immobilization increases the size and intrinsic force capacity of muscle fibers.,False,Description A,228,PrincipleNeuralScience,1.0
Space flight reduces the proportion of type I fibers in some leg muscles.,True,Space flight increases the proportion of type I fibers in some leg muscles.,False,Description A,228,PrincipleNeuralScience,1.0
The force exerted by a muscle during contraction depends on the number of motor units that are activated.,True,The force exerted by a muscle during contraction is independent of the number of motor units that are activated.,False,Description A,228,PrincipleNeuralScience,1.0
The order in which motor units are recruited is determined by intrinsic differences in the responsiveness of individual motor neurons.,True,The order in which motor units are recruited is random and not determined by intrinsic factors.,False,Description A,228,PrincipleNeuralScience,1.0
"Recruitment of motor neurons follows the size principle, starting with the smallest first.",True,"Recruitment of motor neurons follows the size principle, starting with the largest first.",False,Description A,228,PrincipleNeuralScience,1.0
Small motor neurons have a higher input resistance due to fewer ion channels.,True,Small motor neurons have a lower input resistance due to more ion channels.,False,Description A,228,PrincipleNeuralScience,1.0
Motor units in hand muscles are all recruited by about 60% of maximal voluntary contraction.,True,Motor units in hand muscles are all recruited by about 100% of maximal voluntary contraction.,False,Description A,228,PrincipleNeuralScience,1.0
"In biceps brachii, deltoid, and tibialis anterior muscles, recruitment continues up to approximately 85% of maximal force.",True,"In biceps brachii, deltoid, and tibialis anterior muscles, recruitment continues up to approximately 50% of maximal force.",False,Description A,228,PrincipleNeuralScience,1.0
"Beyond the upper limit of motor unit recruitment, changes in muscle force depend on action potential rate.",True,"Beyond the upper limit of motor unit recruitment, changes in muscle force depend on synaptic inputs.",False,Description A,228,PrincipleNeuralScience,1.0
Variation in discharge rate affects muscle force more significantly except at low forces.,True,Variation in discharge rate affects muscle force consistently at all force levels.,False,Description A,228,PrincipleNeuralScience,1.0
The size principle of motor neuron recruitment was enunciated by Elwood Henneman.,True,The size principle of motor neuron recruitment was enunciated by Edgar Adrian.,False,Description A,228,PrincipleNeuralScience,1.0
"In the painting by Anatjari Tjampitjinpa, Tingarri instructors are depicted as concentric circles and their young initiates as horseshoe shapes.",True,"In the painting by Anatjari Tjampitjinpa, Tingarri instructors are depicted as horseshoe shapes and their young initiates as concentric circles.",False,Description A,229,PrincipleNeuralScience,1.0
The painting by Anatjari Tjampitjinpa depicts the sandhill country of the central Australian desert.,True,The painting by Anatjari Tjampitjinpa depicts the rainforest region of northern Australia.,False,Description A,229,PrincipleNeuralScience,1.0
Circuits controlling the forelimb are located in the cervical enlargement.,True,Circuits controlling the forelimb are located in the lumbar spinal cord.,False,Description A,230,PrincipleNeuralScience,1.0
The core of the rhythm-generating circuits in rodents includes Shox2ON and Hb9 neurons.,True,The core of the rhythm-generating circuits in rodents includes V0D and V0V neurons.,False,Description A,230,PrincipleNeuralScience,1.0
The flexor-extensor alternation around the different joints is sequential.,True,The flexor-extensor alternation around the different joints is simultaneous.,False,Description A,230,PrincipleNeuralScience,1.0
V0D commissural neurons make up about half of the V0 population.,True,V0V commissural neurons make up about half of the V0 population.,False,Description A,230,PrincipleNeuralScience,1.0
Left–right alternation depends on crossed inhibition.,True,Left–right alternation depends on direct excitation.,False,Description A,230,PrincipleNeuralScience,1.0
The dual inhibitory system in left–right alternation includes V0 commissural neurons.,True,The dual inhibitory system in left–right alternation includes V3 commissural neurons.,False,Description A,230,PrincipleNeuralScience,1.0
V2a excitatory neurons are part of the left–right alternating circuit.,True,V2a excitatory neurons are part of the flexor-extensor circuit.,False,Description A,230,PrincipleNeuralScience,1.0
Proprioceptors include stretch-sensitive muscle spindles and Golgi tendon organs.,True,Proprioceptors include stretch-sensitive ligaments and Golgi tendon organs.,False,Description A,230,PrincipleNeuralScience,1.0
The stance phase becomes shorter as the stepping rate increases.,True,The swing phase becomes shorter as the stepping rate increases.,False,Description A,230,PrincipleNeuralScience,1.0
Preventing hip extension in a limb suppresses stepping in that limb.,True,Preventing hip flexion in a limb suppresses stepping in that limb.,False,Description A,230,PrincipleNeuralScience,1.0
Activation of sensory fibers from Golgi tendon organs in ankle extensor muscles prolongs the stance phase.,True,Activation of sensory fibers from Golgi tendon organs in hip flexor muscles prolongs the stance phase.,False,Description A,230,PrincipleNeuralScience,1.0
The interlimb coordination pathways involve both inhibitory and excitatory intersegmental connections.,True,The interlimb coordination pathways involve only inhibitory intersegmental connections.,False,Description A,230,PrincipleNeuralScience,1.0
Flexor and extensor modules provide direct motor neuron inhibition in a reciprocal fashion.,True,Flexor and extensor modules provide direct motor neuron excitation in a reciprocal fashion.,False,Description A,230,PrincipleNeuralScience,1.0
V0 commissural neurons are crucial for left–right alternation at all speeds of locomotion.,True,V0 commissural neurons are crucial for left–right synchrony at all speeds of locomotion.,False,Description A,230,PrincipleNeuralScience,1.0
Separate excitatory non-V0 commissural neurons are responsible for synchrony in gaits such as bound and gallop.,True,Separate inhibitory non-V0 commissural neurons are responsible for synchrony in gaits such as bound and gallop.,False,Description A,230,PrincipleNeuralScience,1.0
"The organ of Corti contains approximately 16,000 hair cells arrayed in four rows: a single row of inner hair cells and three rows of outer hair cells.",True,"The organ of Corti contains approximately 10,000 hair cells arrayed in four rows: two rows of inner hair cells and two rows of outer hair cells.",False,Description A,231,PrincipleNeuralScience,1.0
"The tectorial membrane is anchored at its base, and its tapered distal edge forms a fragile connection with the organ of Corti.",True,"The tectorial membrane is not anchored at its base, and its tapered distal edge forms a rigid connection with the organ of Corti.",False,Description A,231,PrincipleNeuralScience,1.0
Outer hair cells are supported at their bases by Deiters’s cells.,True,Outer hair cells are supported at their bases by pillar cells.,False,Description A,231,PrincipleNeuralScience,1.0
"Each organ of Corti contains approximately 30,000 afferent nerve fibers that carry information into the brain along the eighth cranial nerve.",True,"Each organ of Corti contains approximately 20,000 afferent nerve fibers that carry information into the brain along the eighth cranial nerve.",False,Description A,231,PrincipleNeuralScience,1.0
Hair bundles comprise a few tens to a few hundred cylindrical processes called stereocilia.,True,Hair bundles comprise a few tens to a few thousand cylindrical processes called stereocilia.,False,Description A,231,PrincipleNeuralScience,1.0
The inner hair-cell bundles of the mammalian cochlea have a roughly linear form.,True,The inner hair-cell bundles of the mammalian cochlea have a roughly circular form.,False,Description A,231,PrincipleNeuralScience,1.0
"Each stereocilium is of constant diameter along most of its length, tapering just above its basal insertion.",True,"Each stereocilium varies in diameter along most of its length, tapering just below its basal insertion.",False,Description A,231,PrincipleNeuralScience,1.0
Hair cells are not neurons; they lack both dendrites and axons.,True,Hair cells are neurons and they have both dendrites and axons.,False,Description A,231,PrincipleNeuralScience,1.0
"Deflection of the hair bundle toward its tall edge opens additional channels, thereby depolarizing the cell.",True,"Deflection of the hair bundle toward its short edge opens additional channels, thereby depolarizing the cell.",False,Description A,231,PrincipleNeuralScience,1.0
The logarithm of the frequency decreases roughly in proportion to the distance from the cochlea’s base.,True,The logarithm of the frequency increases roughly in proportion to the distance from the cochlea’s base.,False,Description A,231,PrincipleNeuralScience,1.0
The mechanical properties of the cochlear partition as a whole determine the dispersion of sound's frequency components along the cochlea’s longitudinal axis.,True,The electrical properties of the cochlear partition as a whole determine the dispersion of sound's frequency components along the cochlea’s longitudinal axis.,False,Description A,231,PrincipleNeuralScience,1.0
Afferent and efferent nerve endings contact the basolateral surface of the plasma membrane.,True,Afferent and efferent nerve endings contact the apical surface of the plasma membrane.,False,Description A,231,PrincipleNeuralScience,1.0
Outer hair-cell bundles have a V or W shape.,True,Outer hair-cell bundles have a linear shape.,False,Description A,231,PrincipleNeuralScience,1.0
"In an unstimulated cell, 10% to 50% of the channels involved in stimulus transduction are open.",True,"In an unstimulated cell, 0% of the channels involved in stimulus transduction are open.",False,Description A,231,PrincipleNeuralScience,1.0
"Each stereocilium consists of a fascicle of actin filaments heavily cross-linked by proteins plastin, fascin, and epsin.",True,"Each stereocilium consists of a fascicle of collagen filaments heavily cross-linked by proteins plastin, fascin, and epsin.",False,Description A,231,PrincipleNeuralScience,1.0
Fibers from the nasal hemiretina cross to the opposite hemisphere at the optic chiasm.,True,Fibers from the nasal hemiretina stay on the same side at the optic chiasm.,False,Description A,232,PrincipleNeuralScience,1.0
A lesion of the optic chiasm causes a loss of vision in the temporal half of each visual hemifield (bitemporal hemianopsia).,True,A lesion of the optic chiasm causes a loss of vision in the nasal half of each visual hemifield (binasal hemianopsia).,False,Description A,232,PrincipleNeuralScience,1.0
A lesion of the optic tract causes a loss of vision in the opposite half of the visual hemifield (contralateral hemianopsia).,True,A lesion of the optic tract causes a loss of vision in the same half of the visual hemifield (ipsilateral hemianopsia).,False,Description A,232,PrincipleNeuralScience,1.0
Cells in the lateral geniculate nucleus send their axons along the optic radiation to the primary visual cortex.,True,Cells in the lateral geniculate nucleus send their axons directly to the frontal cortex.,False,Description A,232,PrincipleNeuralScience,1.0
The dorsal pathway is concerned with visually guided movement.,True,The dorsal pathway is concerned with object recognition.,False,Description A,232,PrincipleNeuralScience,1.0
The primary visual cortex in each hemisphere represents slightly more than half the visual field.,True,The primary visual cortex in each hemisphere represents less than one-quarter of the visual field.,False,Description A,232,PrincipleNeuralScience,1.0
A major fiber bundle called the corpus callosum connects the two hemispheres.,True,A major fiber bundle called the optic nerve connects the two hemispheres.,False,Description A,232,PrincipleNeuralScience,1.0
The ventral pathway is concerned with object recognition.,True,The ventral pathway is concerned with pupil dilation.,False,Description A,232,PrincipleNeuralScience,1.0
The superior colliculus is involved in eye movement.,True,The superior colliculus is involved in auditory processing.,False,Description A,232,PrincipleNeuralScience,1.0
Functional magnetic resonance imaging (fMRI) has helped to establish homologies between the visual areas of the macaque and human brains.,True,Functional magnetic resonance imaging (fMRI) is incapable of establishing homologies between primate visual areas.,False,Description A,232,PrincipleNeuralScience,1.0
Functional streams in visual processing were appreciated based on pathway tracing studies in monkeys.,True,Functional streams in visual processing were dismissed based on pathway tracing studies in monkeys.,False,Description A,232,PrincipleNeuralScience,1.0
The visual areas of cortex can be differentiated by the functional properties of their neurons.,True,The visual areas of cortex are identical and cannot be differentiated by the functional properties of their neurons.,False,Description A,232,PrincipleNeuralScience,1.0
A lesion in the upper bank of the calcarine sulcus causes a partial deficit in the inferior quadrant.,True,A lesion in the upper bank of the calcarine sulcus causes a partial deficit in the superior quadrant.,False,Description A,232,PrincipleNeuralScience,1.0
Macacque monkeys have more than 30 areas involved with vision.,True,Macakque monkeys have only 10 areas involved with vision.,False,Description A,232,PrincipleNeuralScience,1.0
Light signals are relayed through the midbrain pretectum in the pupillary reflex.,True,Light signals are directly processed in the frontal cortex in the pupillary reflex.,False,Description A,232,PrincipleNeuralScience,1.0
The visual system calculates the brightness of surfaces from information about contrast at the edges of surfaces.,True,The visual system calculates the brightness of surfaces from information about uniform brightness within the surfaces.,False,Description A,233,PrincipleNeuralScience,1.0
Some neurons in V4 respond similarly to different illumination wavelengths if the perceived color remains constant.,True,Some neurons in V4 only respond to varying illumination wavelengths regardless of perceived color consistency.,False,Description A,233,PrincipleNeuralScience,1.0
The visual system assumes that illumination comes from above.,True,The visual system assumes that illumination comes from below.,False,Description A,233,PrincipleNeuralScience,1.0
A plaid pattern moving in a single direction is perceived when gratings are superimposed and moved independently in different directions.,True,Gratings are perceived to slide past each other when superimposed and moved independently in different directions.,False,Description A,233,PrincipleNeuralScience,1.0
The responses of some neurons in the visual cortex correlate with perceived brightness.,True,"The responses of all neurons in the visual cortex solely depend on surface boundaries, not perceived brightness.",False,Description A,233,PrincipleNeuralScience,1.0
The barber-pole illusion is influenced by scene segmentation cues.,True,The barber-pole illusion is unaffected by scene segmentation cues and relies only on local motion.,False,Description A,233,PrincipleNeuralScience,1.0
"Under most conditions, we do not perceive the object itself to be changing even as the retinal image of an object changes.",True,"Under most conditions, we perceive the object itself to be changing whenever the retinal image changes.",False,Description A,233,PrincipleNeuralScience,1.0
Contextual influences are pervasive in intermediate-level visual processing.,True,Contextual influences have minimal impact on intermediate-level visual processing.,False,Description A,233,PrincipleNeuralScience,1.0
"To identify an object, we must know the properties of its surface rather than those of the reflected light.",True,Identifying an object requires knowing the properties of the reflected light rather than its surface.,False,Description A,233,PrincipleNeuralScience,1.0
Perceptual fill-in happens when neurons with receptive fields within a disk begin to respond in a fashion similar to those with receptive fields in the surrounding area.,True,Perceptual fill-in occurs when neurons maintain distinct responses for boundaries and surrounding area without changes.,False,Description A,233,PrincipleNeuralScience,1.0
Motion perception is influenced by the scene's segmentation cues.,True,"Motion perception is determined only by local motion signals, independent of scene segmentation cues.",False,Description A,233,PrincipleNeuralScience,1.0
"Some neurons do respond to the interiors of surfaces, signaling local brightness, texture, or color.",True,No neurons respond to the interiors of surfaces; they only signal boundaries.,False,Description A,233,PrincipleNeuralScience,1.0
Gratings can test whether a neuron is sensitive to local or global motion signals.,True,Gratings provide no information about a neuron's sensitivity to motion signals.,False,Description A,233,PrincipleNeuralScience,1.0
Our ability to perceive an object's size and color as constant illustrates a fundamental principle of the visual system.,True,The visual system passively records images like a camera but often misperceives size and color.,False,Description A,233,PrincipleNeuralScience,1.0
Brightness perception is influenced by three-dimensional shape.,True,Brightness perception is primarily unaffected by three-dimensional shape.,False,Description A,233,PrincipleNeuralScience,1.0
