Description A,Judge A,Description B,Judge B,Answer,Chapter,Book,Version
The vestibular labyrinth in the inner ear contains five receptor organs: two otolith organs (the utricle and saccule) and three semicircular canals.,True,The vestibular labyrinth in the inner ear contains six receptor organs: two otolith organs and four semicircular canals.,False,Description A,140,PrincipleNeuralScience,1.0
"The semicircular canals sense angular accelerations, such as head rotations and tilts.",True,"The semicircular canals sense linear accelerations, such as walking and vertical motion.",False,Description A,140,PrincipleNeuralScience,1.0
The utricle and saccule detect linear motion and static orientation relative to gravity.,True,The utricle and saccule detect rotational motion but not static orientation relative to gravity.,False,Description A,140,PrincipleNeuralScience,1.0
"Endolymph is a K+-rich fluid found within the membranous labyrinth, while perilymph is a high-Na+ fluid found between the membranous and bony labyrinths.",True,"Endolymph is a Na+-rich fluid found within the membranous labyrinth, while perilymph is a K+-rich fluid found between the membranous and bony labyrinths.",False,Description A,140,PrincipleNeuralScience,1.0
Hair cells are mechanoreceptors that deflect stereocilia to produce receptor potentials based on the direction of motion.,True,Hair cells are mechanoreceptors that produce receptor potentials independent of the direction of motion.,False,Description A,140,PrincipleNeuralScience,1.0
The afferent fibers of the vestibulocochlear nerve (cranial nerve VIII) carry vestibular signals to the brain stem and terminate in ipsilateral vestibular nuclei.,True,The afferent fibers of the vestibulocochlear nerve (cranial nerve VIII) carry vestibular signals to the spinal cord and terminate in contralateral spinal nuclei.,False,Description A,140,PrincipleNeuralScience,1.0
The superior vestibular nerve innervates the horizontal and anterior canals and the utricle.,True,The superior vestibular nerve innervates the posterior canal and the saccule.,False,Description A,140,PrincipleNeuralScience,1.0
Otolithic membranes contain thousands of calcium carbonate particles called otoconia.,True,Otolithic membranes contain thousands of potassium carbonate particles called otoconia.,False,Description A,140,PrincipleNeuralScience,1.0
"Head movements cause stereocilia to deflect toward the kinocilium, leading to depolarization of hair cells.",True,"Head movements cause stereocilia to deflect away from the kinocilium, leading to depolarization of hair cells.",False,Description A,140,PrincipleNeuralScience,1.0
"Vestibular nuclei integrate signals from the vestibular organs, spinal cord, cerebellum, and visual system.",True,Vestibular nuclei only integrate signals from the vestibular organs and spinal cord.,False,Description A,140,PrincipleNeuralScience,1.0
People with sleep apnea often experience brief awakenings due to airway obstructions during sleep.,True,People with sleep apnea experience deeper sleep due to improved airway patency during sleep.,False,Description A,141,PrincipleNeuralScience,1.0
Narcolepsy is caused by the selective loss of more than 90% of orexinergic neurons in the hypothalamus.,True,Narcolepsy is caused by excessive activation of orexinergic neurons in the hypothalamus.,False,Description A,141,PrincipleNeuralScience,1.0
"During REM sleep, the body is essentially paralyzed, preventing movement while experiencing vivid dreams.",True,"During REM sleep, muscle tone is increased, allowing movement while experiencing vivid dreams.",False,Description A,141,PrincipleNeuralScience,1.0
"Sleep needs change throughout development, with newborns requiring up to 16 hours of sleep per day.",True,"Sleep needs change throughout development, with newborns requiring less than 8 hours of sleep per day.",False,Description A,141,PrincipleNeuralScience,1.0
REM sleep behavior disorder can be an early sign of Parkinson disease or Lewy body dementia.,True,REM sleep behavior disorder usually indicates advanced immune disorders rather than neurodegenerative conditions.,False,Description A,141,PrincipleNeuralScience,1.0
Obstructive sleep apnea can impair cognition and lead to chronic sleep fragmentation.,True,Obstructive sleep apnea improves cognition due to compensatory respiratory efforts during sleep.,False,Description A,141,PrincipleNeuralScience,1.0
"Restless legs syndrome often occurs in the evening and first half of the night, disrupting sleep.",True,Restless legs syndrome mostly occurs during the early morning hours and improves sleep quality.,False,Description A,141,PrincipleNeuralScience,1.0
Treating fragmented sleep may potentially improve cognition in Alzheimer patients.,True,Fragmented sleep improves cognition in Alzheimer patients due to increased synaptic activity.,False,Description A,141,PrincipleNeuralScience,1.0
The ventrolateral preoptic nucleus plays a key role in initiating sleep by inhibiting the ascending arousal system.,True,The ventrolateral preoptic nucleus promotes wakefulness by activating the ascending arousal system.,False,Description A,141,PrincipleNeuralScience,1.0
"Sleep deprivation can lead to increased deposition of beta-amyloid peptides in the brain, possibly accelerating Alzheimer disease progression.",True,"Sleep deprivation reduces deposition of beta-amyloid peptides in the brain, minimizing the risk of Alzheimer disease.",False,Description A,141,PrincipleNeuralScience,1.0
The T1R1-T1R3 complex is solely responsible for umami taste detection in mice.,True,The T1R1-T1R3 complex is solely responsible for bitter taste detection in mice.,False,Description A,142,PrincipleNeuralScience,1.0
"Sweet receptors in mammals are composed of two subunits, T1R2 and T1R3.",True,"Sweet receptors in mammals are composed of two subunits, T1R1 and T1R3.",False,Description A,142,PrincipleNeuralScience,1.0
Bitter taste is detected by approximately 30 G protein–coupled receptors called T2Rs.,True,Bitter taste is detected by approximately 30 receptor types unrelated to G protein–coupled receptors.,False,Description A,142,PrincipleNeuralScience,1.0
High salt concentrations activate bitter and sour taste cells.,True,High salt concentrations activate sweet taste cells.,False,Description A,142,PrincipleNeuralScience,1.0
The sour taste receptor in mice is the ion channel Otopetrin-1 (Otop1).,True,Sour taste is detected by the G protein–coupled receptor Otopetrin-1 (Otop1).,False,Description A,142,PrincipleNeuralScience,1.0
"Insects have distinct taste cells for sugars, bitter compounds, pheromones, and water.",True,"Insects share the same taste cells for detecting sugars, bitter compounds, pheromones, and water.",False,Description A,142,PrincipleNeuralScience,1.0
"The gustatory cortex contains hot spots for sweet and bitter tastes which, when directly stimulated, can elicit behavioral responses.",True,"The gustatory cortex contains hot spots for sour and salty tastes which, when directly stimulated, can elicit behavioral responses.",False,Description A,142,PrincipleNeuralScience,1.0
"Taste signals travel through cranial nerves VII, IX, and X before reaching the gustatory cortex.",True,Taste signals bypass cranial nerves and directly travel to the gustatory cortex.,False,Description A,142,PrincipleNeuralScience,1.0
Domestic cats lack a functional sweet receptor.,True,Domestic cats and tigers lack functional sour receptors.,False,Description A,142,PrincipleNeuralScience,1.0
Humans have 28 T2R genes for bitter taste detection.,True,Humans have 50 T2R genes for bitter taste detection.,False,Description A,142,PrincipleNeuralScience,1.0
The human brain is a network of more than 80 billion individual nerve cells interconnected in neural circuits.,True,The human brain is a network of less than 10 billion individual nerve cells interconnected in neural circuits.,False,Description A,143,PrincipleNeuralScience,1.0
"The medulla oblongata is directly rostral to the spinal cord and includes centers responsible for digestion, breathing, and the control of heart rate.",True,"The cerebellum is directly rostral to the spinal cord and includes centers responsible for digestion, breathing, and the control of heart rate.",False,Description A,143,PrincipleNeuralScience,1.0
"The hippocampus is critical for the storage of explicit memory, such as memory of people, places, things, and events.",True,"The hippocampus is critical for the storage of implicit memory, such as motor habits and reflexes.",False,Description A,143,PrincipleNeuralScience,1.0
The occipital lobe is primarily responsible for vision and processing visual information.,True,The parietal lobe is primarily responsible for vision and processing visual information.,False,Description A,143,PrincipleNeuralScience,1.0
"In humans, the brain’s rostral-caudal and dorsal-ventral axes are flexed by approximately 110 degrees in the brainstem region.",True,"In humans, the brain’s rostral-caudal and dorsal-ventral axes are flexed by approximately 45 degrees in the brainstem region.",False,Description A,143,PrincipleNeuralScience,1.0
Neural science aims to elucidate how activities of nerve cells within defined circuits mediate complex mental processes.,True,Neural science aims to elucidate how activities of nerve cells within defined circuits are entirely isolated from mental processes.,False,Description A,143,PrincipleNeuralScience,1.0
Modern brain imaging techniques allow scientists to identify specific regions of the brain associated with distinct modes of thinking and feeling.,True,Modern brain imaging techniques allow scientists to map only the spinal cord but are unable to identify specific brain regions.,False,Description A,143,PrincipleNeuralScience,1.0
"The amygdala coordinates the autonomic and endocrine responses of emotional states, such as memory of threats.",True,The amygdala is primarily involved in processing motor tasks and spatial awareness.,False,Description A,143,PrincipleNeuralScience,1.0
"The cerebrum includes two cerebral hemispheres, each consisting of a heavily wrinkled outer layer called the cerebral cortex.",True,"The cerebrum includes two cerebral hemispheres, each consisting of a smooth outer layer called the cerebral cortex.",False,Description A,143,PrincipleNeuralScience,1.0
The principles of neural science aim to appreciate the complexity of the brain without reducing thought to merely molecules or axioms.,True,The principles of neural science reduce the complexity of thought to just molecules and mathematical formulas.,False,Description A,143,PrincipleNeuralScience,1.0
"Interaural time differences are detected by an array of neurons using delay lines from both ears, as proposed by Lloyd Jeffress.",True,"Interaural time differences are detected by an array of neurons using delay lines from only one ear, as proposed by Lloyd Jeffress.",False,Description A,144,PrincipleNeuralScience,1.0
The lateral superior olive balances ipsilateral excitation with contralateral inhibition to localize sounds.,True,The lateral superior olive balances contralateral excitation with ipsilateral inhibition to localize sounds.,False,Description A,144,PrincipleNeuralScience,1.0
"In humans, interaural intensities can differ in sounds that have frequencies greater than about 2 kHz.",True,"In humans, interaural intensities can differ in sounds that have frequencies less than about 2 kHz.",False,Description A,144,PrincipleNeuralScience,1.0
The inferior colliculus serves as a convergence point for ascending auditory pathways.,True,The inferior colliculus serves as a divergence point for descending auditory pathways.,False,Description A,144,PrincipleNeuralScience,1.0
The auditory cortex is tonotopically organized with low frequencies represented anteriorly.,True,The auditory cortex is tonotopically organized with high frequencies represented anteriorly.,False,Description A,144,PrincipleNeuralScience,1.0
The medial olivocochlear neurons' axons terminate on the outer hair cells bilaterally.,True,The lateral olivocochlear neurons' axons terminate on the outer hair cells bilaterally.,False,Description A,144,PrincipleNeuralScience,1.0
Sound from the right generates synchronous EPSPs in the 'yellow' neuron due to a longer conduction delay.,True,Sound from the left generates synchronous EPSPs in the 'yellow' neuron due to a longer conduction delay.,False,Description A,144,PrincipleNeuralScience,1.0
Neurons in the lateral superior olive are activated more strongly by sounds from the ipsilateral than from the contralateral hemifield.,True,Neurons in the lateral superior olive are activated more strongly by sounds from the contralateral than from the ipsilateral hemifield.,False,Description A,144,PrincipleNeuralScience,1.0
Binaural sound cues and monaural spectral cues converge to create a spatial map of sound in the superior colliculus.,True,Only monaural spectral cues create a spatial map of sound in the superior colliculus.,False,Description A,144,PrincipleNeuralScience,1.0
"The lateral olivocochlear neurons send their axons exclusively to the ipsilateral cochlea, terminating on the afferent fibers from inner hair cells.",True,"The lateral olivocochlear neurons send their axons exclusively to the contralateral cochlea, terminating on the afferent fibers from outer hair cells.",False,Description A,144,PrincipleNeuralScience,1.0
"When a subject generates a similar load profile by pulling down on the fixed object, the load force can be anticipated, and thus, the grip force is lower and also tracks the load force without delay.",True,"When a subject generates a similar load profile by pulling down on the fixed object, the load force cannot be anticipated, and thus, the grip force is higher and does not track the load force without delay.",False,Description A,145,PrincipleNeuralScience,1.0
The size–weight illusion does not lessen when a person is informed that the objects are of equal weight and does not weaken with repeated lifting.,True,The size–weight illusion lessens when a person is informed that the objects are of equal weight and weakens with repeated lifting.,False,Description A,145,PrincipleNeuralScience,1.0
Subjects initially generate larger grip and load forces for the larger object because they assume it is heavier.,True,Subjects initially generate smaller grip and load forces for the larger object because they assume it is lighter.,False,Description A,145,PrincipleNeuralScience,1.0
"The motor system is more concerned with controlling the hand, even at the cost of generating complex patterns of joint rotations.",True,"The motor system is more concerned with controlling the joints, even at the cost of generating simple patterns of hand movements.",False,Description A,145,PrincipleNeuralScience,1.0
The optimal movement is one that minimizes the bad consequences of noise while saving energy.,True,The optimal movement is one that maximizes the bad consequences of noise while using more energy.,False,Description A,145,PrincipleNeuralScience,1.0
"Optimal feedback control emphasizes feedback gains, which can be partially instantiated by reflexes that generate rapid motor responses.",True,"Optimal feedback control dismisses feedback gains, which cannot be instantiated by reflexes that generate rapid motor responses.",False,Description A,145,PrincipleNeuralScience,1.0
Error-based learning involves adapting internal sensorimotor models.,True,Error-based learning ignores the adaptation of internal sensorimotor models.,False,Description A,145,PrincipleNeuralScience,1.0
Most motor learning tends to become automatic with time.,True,Most motor learning tends to remain non-automatic with time.,False,Description A,145,PrincipleNeuralScience,1.0
The variability of force production increases with the level of the force.,True,The variability of force production decreases with the level of the force.,False,Description A,145,PrincipleNeuralScience,1.0
Learning skills involves improving performance in the absence of a perturbation.,True,Learning skills involves degrading performance in the presence of a perturbation.,False,Description A,145,PrincipleNeuralScience,1.0
"Channelopathies can affect phases of synaptic transmission, including neurotransmitter release and neuronal excitability.",True,Channelopathies are the only cause of all human epilepsies affecting synaptic transmission.,False,Description A,146,PrincipleNeuralScience,1.0
"Many epilepsy genes can affect multiple phases of synaptic transmission, including the migration of interneurons and the release of neurotransmitters.",True,Epilepsy genes only affect the genetic code without influencing neurotransmitter functionality or interneuron migration.,False,Description A,146,PrincipleNeuralScience,1.0
"Helmholtz proposed the idea of unconscious inference, believing the brain makes decisions without our awareness.",True,Helmholtz believed that consciousness is necessary for all brain activity and inferences.,False,Description A,146,PrincipleNeuralScience,1.0
"The majority of cognitive processing never enters consciousness, supporting Helmholtz's theory.",True,"All cognitive processing is consciously perceived, contrary to Helmholtz's theory.",False,Description A,146,PrincipleNeuralScience,1.0
"Unconscious processing in patients can be demonstrated using images with differences, such as a fire in one of two identical-looking houses.",True,Patients with unconscious processing deficits cannot be shown images with differences despite their ability to process it.,False,Description A,146,PrincipleNeuralScience,1.0
"Unilateral neglect can result from lesions in the right parietal lobe, causing patients to ignore the left side of objects.",True,Unilateral neglect affects only the right side of objects and is caused by lesions in the left occipital lobe.,False,Description A,146,PrincipleNeuralScience,1.0
Interneurons have an essential role in epilepsy by influencing network formation and synaptic conductances.,True,Interneurons are irrelevant for network formation and synaptic conductances in epilepsy.,False,Description A,146,PrincipleNeuralScience,1.0
Change blindness occurs when perception remains unchanged despite significant sensory input alterations.,True,Change blindness is characterized by an immediate perception change when sensory input is altered.,False,Description A,146,PrincipleNeuralScience,1.0
The Rubin figure and Necker cube demonstrate that perception changes can occur without changes in sensory stimulation.,True,The Rubin figure and Necker cube show that sensory input changes always lead to perception changes.,False,Description A,146,PrincipleNeuralScience,1.0
"In schizophrenia, hallucinations are sometimes linked to increased neural activity in specific sensory brain regions.",True,Hallucinations in schizophrenia are unrelated to any neural activity changes in sensory brain regions.,False,Description A,146,PrincipleNeuralScience,1.0
Transmitter release can be modulated intrinsically or extrinsically as an aspect of synaptic plasticity.,True,Transmitter release can only be modulated extrinsically as an aspect of synaptic plasticity.,False,Description A,147,PrincipleNeuralScience,1.0
Synaptic strength can be influenced by the pattern of firing in phenomena known as 'depression' and 'facilitation.',True,Synaptic strength can only be affected by external substances and not by the pattern of firing.,False,Description A,147,PrincipleNeuralScience,1.0
Extrinsic neuromodulators can alter the dynamics of release by regulation of Ca2+ channels.,True,Extrinsic neuromodulators do not affect the dynamics of release through Ca2+ channels.,False,Description A,147,PrincipleNeuralScience,1.0
The interaction of neurotransmitters with receptors is typically transient.,True,The interaction of neurotransmitters with receptors is typically permanent.,False,Description A,147,PrincipleNeuralScience,1.0
A neurotransmitter typically acts on a target other than the releasing neuron itself.,True,A neurotransmitter always acts on the releasing neuron itself.,False,Description A,147,PrincipleNeuralScience,1.0
Neuropeptides and small-molecule transmitters can be co-released.,True,Neuropeptides and small-molecule transmitters cannot be released together.,False,Description A,147,PrincipleNeuralScience,1.0
Removal of the transmitter from the synaptic cleft terminates synaptic transmission.,True,Synaptic transmission continues indefinitely after transmitter release.,False,Description A,147,PrincipleNeuralScience,1.0
Small-molecule transmitters are actively taken up into vesicles.,True,Small-molecule transmitters are not actively taken up into vesicles.,False,Description A,147,PrincipleNeuralScience,1.0
Synaptic vesicles are closely associated with specific Ca2+ channels at active zones.,True,Synaptic vesicles are randomly scattered and have no specific association with Ca2+ channels.,False,Description A,147,PrincipleNeuralScience,1.0
Ca2+ entry evoked by an action potential leads to neurotransmitter release.,True,Ca2+ entry does not play a role in neurotransmitter release.,False,Description A,147,PrincipleNeuralScience,1.0
"In mice lacking rapsyn, muscles form normally and ACh receptors accumulate in normal numbers but fail to aggregate at the synaptic sites on the membrane.",True,"In mice lacking rapsyn, muscles do not form normally and ACh receptors fail to accumulate in normal numbers at the synaptic sites on the membrane.",False,Description A,148,PrincipleNeuralScience,1.0
Agrin is required to maintain clustering of ACh receptors at synaptic sites.,True,Agrin is not required to maintain clustering of ACh receptors at synaptic sites.,False,Description A,148,PrincipleNeuralScience,1.0
The motor neuron ensures that patches of postsynaptic membrane contacted by axon branches are rich in ACh receptors.,True,The motor neuron ensures that patches of postsynaptic membrane are devoid of ACh receptors.,False,Description A,148,PrincipleNeuralScience,1.0
"After birth, all motor axons but one withdraw from each fiber, and the surviving axon becomes more elaborate.",True,"After birth, all motor axons remain at each fiber and none withdraw.",False,Description A,148,PrincipleNeuralScience,1.0
"The synapses that form in neurexin- or neuroligin-lacking mutants are defective, with varying nature and severity of defects among synaptic types.",True,The synapses that form in neurexin- or neuroligin-lacking mutants are perfectly functional without any defects.,False,Description A,148,PrincipleNeuralScience,1.0
Pre- and postsynaptic elements regulate each other's differentiation by organizing synaptic components.,True,Pre- and postsynaptic elements do not influence differentiation or organization of synaptic components.,False,Description A,148,PrincipleNeuralScience,1.0
Gephyrin is highly concentrated in synaptic densities at glycinergic and some GABAergic synapses.,True,Gephyrin is not present in synaptic densities at glycinergic and some GABAergic synapses.,False,Description A,148,PrincipleNeuralScience,1.0
Newly formed myotubes exhibit expression of genes encoding ACh receptor subunits in most nuclei.,True,Newly formed myotubes do not exhibit expression of genes encoding ACh receptor subunits in any nuclei.,False,Description A,148,PrincipleNeuralScience,1.0
"ACh receptors are composed of α-, β-, δ-, and ε-subunits postnatally.",True,"ACh receptors are composed of α-, β-, δ-, and γ-subunits postnatally.",False,Description A,148,PrincipleNeuralScience,1.0
The nerve uses ACh to repress expression of ACh receptor genes extrasynaptically.,True,The nerve uses ACh to enhance expression of ACh receptor genes extrasynaptically.,False,Description A,148,PrincipleNeuralScience,1.0
The amygdala is necessary for Pavlovian fear conditioning: Animals with amygdala damage fail to learn the association between the CS and the US.,True,The hypothalamus is necessary for Pavlovian fear conditioning: Animals with hypothalamus damage fail to learn the association between the CS and the US.,False,Description A,149,PrincipleNeuralScience,1.0
The lateral nucleus of the amygdala receives sensory input from the thalamus directly.,True,The central nucleus of the amygdala receives sensory input from the thalamus directly.,False,Description A,149,PrincipleNeuralScience,1.0
The central amygdala mediates outputs to brain stem areas involved in the control of defensive behaviors.,True,The lateral amygdala mediates outputs to brain stem areas involved in the control of defensive behaviors.,False,Description A,149,PrincipleNeuralScience,1.0
Figure 42–5 shows that the lateral nucleus communicates with the central nucleus directly.,True,Figure 42–5 shows that the lateral nucleus communicates with the lateral prefrontal region directly.,False,Description A,149,PrincipleNeuralScience,1.0
Neural circuits engaged during fear conditioning involve both the lateral and central nuclei of the amygdala.,True,Neural circuits engaged during fear conditioning involve both the basal and cingulate nuclei of the amygdala.,False,Description A,149,PrincipleNeuralScience,1.0
The emotional charge of a stimulus is evaluated by the amygdala together with other brain structures like the prefrontal cortex.,True,The emotional charge of a stimulus is evaluated solely by the amygdala without any other brain structures.,False,Description A,149,PrincipleNeuralScience,1.0
The amygdala's connections with dopaminergic nuclei influence cognitive processing.,True,The amygdala's connections with occipital nuclei influence cognitive processing.,False,Description A,149,PrincipleNeuralScience,1.0
