Description A,Judge A,Description B,Judge B,Answer,Chapter,Book,Version
Damage to the cerebellar flocculus impairs the ability to modulate the gain of the vestibulo-ocular reflex.,True,Damage to the cerebellar flocculus enhances the ability to modulate the gain of the vestibulo-ocular reflex.,False,Description A,44,PrincipleNeuralScience,1.0
"The vestibular nuclei project to the oculomotor nuclei, reticular formation, lateral medullary nuclei, thalamus, and cerebellum.",True,"The vestibular nuclei project to the oculomotor nuclei, spinal cord, prefrontal cortex, thalamus, and cerebellum.",False,Description A,44,PrincipleNeuralScience,1.0
"The oculomotor center outputs include the abducens, oculomotor, and trochlear nuclei.",True,"The oculomotor center outputs include the trigeminal, oculomotor, and trochlear nuclei.",False,Description A,44,PrincipleNeuralScience,1.0
"Individual vestibular nuclei neurons can play roles in eye movements, head movements, and even posture.",True,Individual vestibular nuclei neurons exclusively coordinate eye movements without involvement in head movements or posture.,False,Description A,44,PrincipleNeuralScience,1.0
The translational vestibulo-ocular reflex compensates for linear head movements.,True,The translational vestibulo-ocular reflex compensates for rotational head movements.,False,Description A,44,PrincipleNeuralScience,1.0
The direction of nystagmus is clinically defined by the direction of its quick phase.,True,The direction of nystagmus is clinically defined by the direction of its slow phase.,False,Description A,44,PrincipleNeuralScience,1.0
Stimulation of the left PMRF during the swing phase of the left limb produces a transient increase in the electromyogram activity of the left flexor muscles and a simultaneous decrease in activity in the right extensor muscles.,True,Stimulation of the left PMRF during the swing phase of the left limb produces a transient increase in the electromyogram activity of the left extensor muscles and a simultaneous decrease in activity in the right flexor muscles.,False,Description A,45,PrincipleNeuralScience,1.0
"Lesions in the posterior parietal cortex (PPC) cause walking cats to misplace the positioning of their paws as they approach an obstacle, increasing the probability of contact with the obstacle.",True,"Lesions in the posterior parietal cortex (PPC) improve walking cats' ability to navigate around obstacles, reducing the probability of contact with the obstacle.",False,Description A,45,PrincipleNeuralScience,1.0
"The motor cortex is essential for visually guided locomotion, especially when precise limb trajectory and foot placement adjustments are required.",True,The motor cortex is not essential for visually guided locomotion and does not contribute to precise limb trajectory or foot placement adjustments.,False,Description A,45,PrincipleNeuralScience,1.0
"During locomotion, the cerebellum integrates motor commands, proprioceptive input, and state information from the spinal circuits to correct motor errors.",True,"During locomotion, the cerebellum only processes visual input and does not integrate motor commands or spinal circuit information.",False,Description A,45,PrincipleNeuralScience,1.0
Treadmill training combined with weight support helps patients with partial spinal cord injury improve locomotor function by facilitating spinal circuit activity.,True,Treadmill training combined with weight support is ineffective at improving locomotor function in patients with partial spinal cord injury.,False,Description A,45,PrincipleNeuralScience,1.0
"Patients with Parkinson's disease exhibit a characteristic slow, shuffling gait, caused by disruptions in basal ganglia function.",True,"Patients with Parkinson's disease exhibit a fast, coordinated gait, caused by improvements in basal ganglia function.",False,Description A,45,PrincipleNeuralScience,1.0
"Human infants display rhythmic stepping movements immediately after birth, suggesting innate central pattern generators in the spinal cord.",True,"Human infants do not display rhythmic stepping movements after birth, indicating the absence of central pattern generators in the spinal cord.",False,Description A,45,PrincipleNeuralScience,1.0
Precise corticospinal control enables humans to adapt locomotor rhythms to complex terrains and obstacles.,True,Corticospinal control does not play a role in helping humans adapt locomotor rhythms to complex terrains and obstacles.,False,Description A,45,PrincipleNeuralScience,1.0
Damage to the cerebellum impairs limb coordination and produces ataxia during locomotion.,True,Damage to the cerebellum enhances limb coordination and prevents ataxia during locomotion.,False,Description A,45,PrincipleNeuralScience,1.0
"Computational modeling of locomotor circuits helps reveal the dynamic interactions within neural networks, offering insights into rhythm and pattern generation.",True,Computational modeling is irrelevant for studying locomotor neural networks and cannot provide insights into rhythm and pattern generation.,False,Description A,45,PrincipleNeuralScience,1.0
Microglia in the dorsal horn are activated due to damage to the peripheral branch of primary sensory neurons.,True,Microglia in the dorsal horn are activated due to damage to the central branch of primary sensory neurons.,False,Description A,46,PrincipleNeuralScience,1.0
The spinothalamic tract has a crucial role in the transmission of nociceptive information.,True,The spinoreticular tract has a crucial role in the transmission of nociceptive information.,False,Description A,46,PrincipleNeuralScience,1.0
Neurons in the lateral thalamic nuclei process information about the precise location of an injury.,True,Neurons in the medial thalamic nuclei process information about the precise location of an injury.,False,Description A,46,PrincipleNeuralScience,1.0
Lesioning the spinothalamic tract can reduce sensation of pain contralateral to the lesion.,True,Lesioning the spinothalamic tract can reduce sensation of pain ipsilateral to the lesion.,False,Description A,46,PrincipleNeuralScience,1.0
The insular cortex processes information about the internal state of the body and contributes to autonomic components of pain responses.,True,The somatosensory cortex processes information about the internal state of the body and contributes to autonomic components of pain responses.,False,Description A,46,PrincipleNeuralScience,1.0
Electrical stimulation of the periaqueductal gray matter can selectively block nociception.,True,Electrical stimulation of the anterior cingulate cortex can selectively block nociception.,False,Description A,46,PrincipleNeuralScience,1.0
The gate control theory of pain suggests that nonnociceptive inputs can attenuate pain by closing a 'gate' at the dorsal horn.,True,The gate control theory of pain suggests that only nociceptive inputs can modulate the 'gate' at the dorsal horn.,False,Description A,46,PrincipleNeuralScience,1.0
Dynorphins interact primarily with kappa (κ) opioid receptors.,True,Dynorphins interact primarily with mu (μ) opioid receptors.,False,Description A,46,PrincipleNeuralScience,1.0
Neurons in the anterior cingulate cortex integrate the emotional aspects of pain.,True,Neurons in the anterior cingulate cortex integrate the sensory aspects of pain.,False,Description A,46,PrincipleNeuralScience,1.0
"Morphine is more effective for persistent 'second pain' than for fast, acute 'first pain.'",True,"Morphine is more effective for fast, acute 'first pain' than for persistent 'second pain.'",False,Description A,46,PrincipleNeuralScience,1.0
"Cranial nerves mediate the sensory and motor functions of the face and head, as well as the autonomic functions of the body.",True,"Cranial nerves do not mediate the autonomic functions of the body, only the sensory functions of the face and motor functions of the head.",False,Description A,47,PrincipleNeuralScience,1.0
"The trochlear (IV) nerve exits from the dorsal surface of the midbrain, behind the inferior colliculus.",True,"The trochlear (IV) nerve exits from the ventral surface of the brain stem, like all other cranial nerves.",False,Description A,47,PrincipleNeuralScience,1.0
The oculomotor (III) nerve provides parasympathetic innervation responsible for pupillary constriction and lens accommodation.,True,The oculomotor (III) nerve provides somatic motor innervation only and is not responsible for parasympathetic functions.,False,Description A,47,PrincipleNeuralScience,1.0
The reticular formation in the brain stem contains glutamatergic and GABAergic circuitry that regulates wake–sleep cycles and breathing.,True,"The reticular formation in the brain stem contains glutamatergic circuitry, but does not use GABAergic processes for regulating breathing or wake–sleep cycles.",False,Description A,47,PrincipleNeuralScience,1.0
"Hydranencephalic infants can cry, smile, and suckle despite not having a forebrain, as the brain stem organizes such behaviors.",True,"Hydranencephalic infants cannot cry, smile, or suckle, as such behaviors are controlled exclusively by the forebrain.",False,Description A,47,PrincipleNeuralScience,1.0
The glossopharyngeal (IX) nerve transmits visceral information about blood oxygen and carbon dioxide levels from the carotid body.,True,The glossopharyngeal (IX) nerve transmits visceral information about blood oxygen and carbon dioxide levels from the vagus nerve.,False,Description A,47,PrincipleNeuralScience,1.0
"The vagus (X) nerve provides parasympathetic control to most of the internal organs in the neck, thorax, and abdomen.",True,The vagus (X) nerve provides motor control to facial expression but does not participate in autonomic regulation.,False,Description A,47,PrincipleNeuralScience,1.0
Cranial nerve reflexes involve both mono- and polysynaptic brain stem relays for coordination of simple behaviors.,True,Cranial nerve reflexes involve only monosynaptic relays and do not use polysynaptic pathways in the brain stem.,False,Description A,47,PrincipleNeuralScience,1.0
"The three sensory divisions of the trigeminal (V) nerve innervate distinct areas of the face, scalp, and oral cavity.",True,The three sensory divisions of the trigeminal (V) nerve only innervate the muscles of mastication and the tongue.,False,Description A,47,PrincipleNeuralScience,1.0
The spinal accessory (XI) nerve is purely motor and innervates the trapezius and sternocleidomastoid muscles.,True,The spinal accessory (XI) nerve includes both motor and sensory functions and innervates the entire neck musculature.,False,Description A,47,PrincipleNeuralScience,1.0
"The oculomotor system uses visual information to guide eye movements, requiring coordination of 12 muscles that move the two eyes.",True,"The oculomotor system uses auditory information to guide eye movements, requiring coordination of 12 muscles that move the two eyes.",False,Description A,48,PrincipleNeuralScience,1.0
"Horizontal rotation of the eye away from the nose is called abduction, while rotation toward the nose is called adduction.",True,"Horizontal rotation of the eye away from the nose is called adduction, while rotation toward the nose is called abduction.",False,Description A,48,PrincipleNeuralScience,1.0
"The lateral rectus muscle abducts the eye, and the medial rectus muscle adducts it.",True,"The lateral rectus muscle adducts the eye, and the medial rectus muscle abducts it.",False,Description A,48,PrincipleNeuralScience,1.0
"The superior oblique muscle depresses the eye when it is adducted, but intorts the eye when it is abducted.",True,"The superior oblique muscle elevates the eye when it is adducted, but extorts the eye when it is abducted.",False,Description A,48,PrincipleNeuralScience,1.0
"The primary role of the oculomotor system in humans is to position the fovea, which provides the sharpest vision, onto objects of interest.",True,The primary role of the oculomotor system in humans is to position the peripheral retina onto objects of interest.,False,Description A,48,PrincipleNeuralScience,1.0
The six extraocular muscles are grouped into three agonist-antagonist pairs.,True,The six extraocular muscles are grouped into six distinct agonist-antagonist pairs.,False,Description A,48,PrincipleNeuralScience,1.0
"The trochlear nerve (cranial nerve IV) innervates the superior oblique muscle, which passes through a bony pulley called the trochlea.",True,"The trochlear nerve (cranial nerve IV) innervates the inferior oblique muscle, which passes through a bony pulley called the trochlea.",False,Description A,48,PrincipleNeuralScience,1.0
Binocular vision allows stereopsis and depth perception by overlapping the visual fields of the two eyes.,True,Binocular vision removes stereopsis and depth perception by separating the visual fields of the two eyes.,False,Description A,48,PrincipleNeuralScience,1.0
The medial and lateral recti muscles rotate the eyes horizontally—adduction for the medial rectus and abduction for the lateral rectus.,True,The medial and lateral recti muscles rotate the eyes vertically—elevation for the medial rectus and depression for the lateral rectus.,False,Description A,48,PrincipleNeuralScience,1.0
Lesions of the abducens nerve result in the inability of the eye to abduct beyond the midline.,True,Lesions of the abducens nerve result in the inability of the eye to adduct beyond the midline.,False,Description A,48,PrincipleNeuralScience,1.0
Patients with multiple sclerosis can learn to improve their postural control with practice but may need more practice to retain the improvement compared to healthy individuals.,True,Patients with multiple sclerosis cannot learn to improve their postural control with practice regardless of effort.,False,Description A,49,PrincipleNeuralScience,1.0
"During voluntary arm pulls in a supported stance, anticipatory leg muscle activity is unnecessary due to reliance on external support for postural stability.",True,"During voluntary arm pulls in a supported stance, anticipatory leg muscle activity is necessary despite external support.",False,Description A,49,PrincipleNeuralScience,1.0
"Postural equilibrium during walking depends on precise foot placement, which controls the speed and trajectory of the center of mass.",True,Postural equilibrium during walking is unaffected by foot placement and controlled solely by visual cues.,False,Description A,49,PrincipleNeuralScience,1.0
Vestibular information is critical when visual and somatosensory cues are ambiguous or absent during challenging postural tasks.,True,Vestibular information is insignificant when visual and somatosensory cues are ambiguous or absent during challenging postural tasks.,False,Description A,49,PrincipleNeuralScience,1.0
"Visual inputs can induce illusions of motion, leading to compensatory tilting of the body.",True,Visual inputs are incapable of inducing illusions of motion or compensatory body tilts.,False,Description A,49,PrincipleNeuralScience,1.0
"Loss of large-diameter somatosensory fibers leads to delays in automatic postural responses, increasing the risk of falls.",True,"Loss of large-diameter somatosensory fibers improves automatic postural response timings, reducing the risk of falls.",False,Description A,49,PrincipleNeuralScience,1.0
"The body schema integrates sensory information from somatosensory, vestibular, and visual systems to compute postural orientation.",True,"The body schema functions independently of sensory inputs, relying solely on motor commands for postural orientation.",False,Description A,49,PrincipleNeuralScience,1.0
Individual sensory modalities can provide ambiguous information about postural orientation and motion.,True,Individual sensory modalities always provide accurate and unambiguous information about postural orientation and motion.,False,Description A,49,PrincipleNeuralScience,1.0
"Patients with vestibular deficits depend on somatosensory inputs, leading to postural instability during surface tilts.",True,"Patients with vestibular deficits compensate effectively using visual inputs, eliminating postural instability during surface tilts.",False,Description A,49,PrincipleNeuralScience,1.0
Visual processing is too slow to significantly affect rapid postural responses to sudden disturbances.,True,Visual processing is the fastest modality for regulating rapid postural responses to sudden disturbances.,False,Description A,49,PrincipleNeuralScience,1.0
"In tritanopes, the loss of S-cone function arises from mutations in the S-pigment gene.",True,"In tritanopes, the loss of S-cone function arises from mutations in the L-pigment gene.",False,Description A,50,PrincipleNeuralScience,1.0
"For vision under low-light conditions, the mammalian retina has an ON bipolar cell that is exclusively connected to rods.",True,"For vision under low-light conditions, the mammalian retina has an OFF bipolar cell that is exclusively connected to rods.",False,Description A,50,PrincipleNeuralScience,1.0
"Retinal ganglion cells encode a 10-fold range of image intensities caused by object reflectances, instead of a 10-billion-fold range caused by ambient illumination variations.",True,"Retinal ganglion cells encode a 10-billion-fold range of image intensities caused by object reflectances, instead of a 10-fold range caused by ambient illumination variations.",False,Description A,50,PrincipleNeuralScience,1.0
The lateral shifting of the stimulus–response relationship is a hallmark of light adaptation in the retina.,True,The lateral shifting of the stimulus–response relationship is a hallmark of color adaptation in the retina.,False,Description A,50,PrincipleNeuralScience,1.0
"Under Weber’s law, threshold flash intensity should be proportional to the background intensity.",True,"Under Weber’s law, threshold flash intensity should decrease as background intensity increases.",False,Description A,50,PrincipleNeuralScience,1.0
Light adaptation involves gain changes at multiple sites within the retina.,True,Light adaptation does not involve gain changes at any site within the retina but occurs entirely in the brain.,False,Description A,50,PrincipleNeuralScience,1.0
"By dawn, rod cells saturate and cones take over due to gradual stimulation by increasing light intensities.",True,"By dawn, cone cells saturate and rods take over due to gradual stimulation by increasing light intensities.",False,Description A,50,PrincipleNeuralScience,1.0
Calcium-dependent feedback pathways within photoreceptors help regulate light adaptation.,True,Potassium-dependent feedback pathways within photoreceptors help regulate light adaptation.,False,Description A,50,PrincipleNeuralScience,1.0
"In bright light, ganglion cells often display strong center-surround antagonism in their receptive fields.",True,"In bright light, ganglion cells often lose their center-surround antagonism in their receptive fields.",False,Description A,50,PrincipleNeuralScience,1.0
Dopamine released by specialized amacrine cells regulates changes in lateral inhibition.,True,Serotonin released by specialized amacrine cells regulates changes in lateral inhibition.,False,Description A,50,PrincipleNeuralScience,1.0
The brain stem regulates wakefulness and sleep and plays a critical role in controlling respiration and heartbeat.,True,The brain stem regulates emotions and directly controls cognitive decision-making processes.,False,Description A,51,PrincipleNeuralScience,1.0
"Subcortical brain regions are bidirectionally connected with cortical brain areas, allowing internal state variables to influence cognitive functions.",True,Subcortical brain regions are exclusively connected to the motor cortex and cannot influence cognitive functions.,False,Description A,51,PrincipleNeuralScience,1.0
The hypothalamus maintains physiological stability by regulating the endocrine system and the autonomic nervous system.,True,The hypothalamus primarily controls skeletal muscle movement and is unrelated to physiological stability.,False,Description A,51,PrincipleNeuralScience,1.0
"The dopaminergic pathways are involved in processing stimuli related to reinforcement expectation, contributing to motivational states.",True,The dopaminergic pathways are exclusively involved in regulating sleep and have no impact on reinforcement or motivation.,False,Description A,51,PrincipleNeuralScience,1.0
"Lesions in the human amygdala impair fear learning, expression, and recognition in others.",True,Lesions in the human amygdala improve fear learning and expression while enhancing recognition in others.,False,Description A,51,PrincipleNeuralScience,1.0
"The medial and ventral prefrontal cortex are closely interconnected with the amygdala, influencing emotional regulation and decision-making.",True,The medial and ventral prefrontal cortex are isolated from the amygdala and do not influence emotional regulation or decision-making.,False,Description A,51,PrincipleNeuralScience,1.0
"Homeostatic processes in the nervous system have significant behavioral consequences, as studied by early physiologists like Claude Bernard and Walter Cannon.",True,Homeostatic processes in the nervous system have minimal behavioral consequences and are mostly unrelated to the work of early physiologists.,False,Description A,51,PrincipleNeuralScience,1.0
Addictive drugs like nicotine and alcohol impact neural pathways that reinforce survival behaviors.,True,Addictive drugs like nicotine and alcohol completely bypass neural pathways related to survival behaviors.,False,Description A,51,PrincipleNeuralScience,1.0
"The amygdala orchestrates emotional responses by interacting with the hypothalamus, brain stem, and cortex.",True,"The amygdala functions independently of the hypothalamus, brain stem, and cortex in managing emotional responses.",False,Description A,51,PrincipleNeuralScience,1.0
Disorders of electrical excitation in corticothalamic circuits can lead to conditions like seizures and epilepsy.,True,Disorders of electrical excitation in corticothalamic circuits are unrelated to conditions like seizures and epilepsy.,False,Description A,51,PrincipleNeuralScience,1.0
"Loss of gray matter in the prefrontal, temporal, and parietal regions of the cerebral cortex is a well-documented abnormality in schizophrenia.",True,"Loss of gray matter in the occipital, limbic, and cerebellar regions of the cerebral cortex is a well-documented abnormality in schizophrenia.",False,Description A,52,PrincipleNeuralScience,1.0
First-degree relatives who do not have a diagnosis of schizophrenia often exhibit cortical gray matter loss intermediate between healthy individuals and those diagnosed with schizophrenia.,True,First-degree relatives who do not have a diagnosis of schizophrenia exhibit no differences in cortical gray matter compared to healthy individuals.,False,Description A,52,PrincipleNeuralScience,1.0
The polygenic risk score provides probabilistic information about susceptibility to schizophrenia and can stratify populations in clinical studies.,True,The polygenic risk score provides definitive diagnostic information about schizophrenia and directly determines treatment plans.,False,Description A,52,PrincipleNeuralScience,1.0
The 22q11.2 microdeletion is the most common and well-studied genetic cause of syndromic schizophrenia.,True,The 20q13.3 microdeletion is the most common and well-studied genetic cause of syndromic schizophrenia.,False,Description A,52,PrincipleNeuralScience,1.0
"Schizophrenia is associated with decreased functional connectivity between brain regions, as demonstrated by resting-state functional MRI.",True,"Schizophrenia is associated with increased functional connectivity between brain regions, as demonstrated by resting-state functional MRI.",False,Description A,52,PrincipleNeuralScience,1.0
Excessive and inappropriate synaptic pruning during adolescence is a proposed mechanism for schizophrenia.,True,Increased synaptic formation during adolescence is a proposed mechanism for schizophrenia.,False,Description A,52,PrincipleNeuralScience,1.0
Antipsychotic drugs primarily block D2 dopamine receptors in the brain to reduce psychotic symptoms.,True,Antipsychotic drugs primarily block serotonin receptors in the brain to reduce psychotic symptoms.,False,Description A,52,PrincipleNeuralScience,1.0
Abnormal dopamine transmission in subcortical brain regions may contribute to the psychotic symptoms of schizophrenia.,True,Abnormal dopamine transmission in cortical brain regions solely accounts for all symptoms of schizophrenia.,False,Description A,52,PrincipleNeuralScience,1.0
"Patients with schizophrenia often demonstrate fewer dendritic spines on pyramidal neurons, reflecting a loss of synaptic contacts.",True,"Patients with schizophrenia often demonstrate increased dendritic spines on pyramidal neurons, reflecting an overabundance of synaptic contacts.",False,Description A,52,PrincipleNeuralScience,1.0
Current antipsychotic drugs do not effectively treat the cognitive impairments or deficit symptoms of schizophrenia.,True,Current antipsychotic drugs fully resolve cognitive impairments and deficit symptoms of schizophrenia.,False,Description A,52,PrincipleNeuralScience,1.0
Calcium acts as a second messenger to trigger the release of additional Ca2+ from internal stores by binding to the ryanodine receptor in the smooth endoplasmic reticulum membrane.,True,Calcium acts as a second messenger to bind to potassium channels in the plasma membrane to trigger the release of additional Ca2+.,False,Description A,53,PrincipleNeuralScience,1.0
"The ryanodine receptor is opened by cytoplasmic Ca2+ and binds the plant alkaloid ryanodine, which inhibits the receptor.",True,The ryanodine receptor is opened by IP3 and is inhibited by cytoplasmic calcium.,False,Description A,53,PrincipleNeuralScience,1.0
